Label,Video,Shuffle,Speaker,Party,Activation,Sentiment,englishHansard
0000719,2016 03 09 8,0.465703,"Mr. Alupa Clarke (Beauport—Limoilou, CPC)",CPC,5,6,"Mr. Speaker, yesterday, the Minister of Veterans Affairs indicated that he was working with the Department of Canadian Heritage to identify opportunities for advancing the construction of a memorial monument."
0000199,2017 06 13 8,0.465974,James Bezan,CPC,5,4,"Mr. Speaker, the Liberals are planning on closing Canadian Coast Guard stations in Gimli, Selkirk, and Kenora."
0000375,2017 02 07 4,0.466664,"Mr. Gérard Deltell (Louis-Saint-Laurent, CPC)",CPC,7,3,"Mr. Speaker, yesterday, the Minister of Finance once again succeeded in not giving a clear answer to Canadians when I asked him whether his government intended to attack pension splitting."
0000847,2015 06 04 6,0.467625,"Hon. Pierre Poilievre (Minister of Employment and Social Development and Minister for Democratic Reform, CPC)",CPC,6,6,"Mr. Speaker, while both the NDP and Liberal Party have announced they support Kathleen Wynne's plan to bring in a $1,000 payroll tax on the average worker in Canada, we have done exactly the opposite. "
0000769,2016 02 02 8,0.468353,"Hon. Carolyn Bennett (Minister of Indigenous and Northern Affairs, Lib.):  ",LIB,6,7,We will work with first nations and achieve the goal of transparency and accountability with them.
0000923,2015 04 01 2,0.469252,"Right Hon. Stephen Harper (Prime Minister, CPC)",CPC,6,4,We are still trying to find 40 million of those dollars.
0000224,2017 06 01 3,0.469432,Sylvie Boucher,CPC,7,3, Will the minister cancel this proposed appointment or will we have to get to the bottom of the process and call for a public inquiry?
0000094,2017 10 30 3,0.469925,Joel Lightbound,LIB,6,7,"I think that is a wonderful gesture that demonstrates the minister's commitment to serving the public, which is the very reason he left the private sector two years ago. He has been serving the public extremely successfully by growing the economy, reducing inequality, and ensuring inclusive prosperity for all Canadians."
0000335,2017 02 24 4,0.470155,"Mr. Mark Strahl (Chilliwack—Hope, CPC)",CPC,7,3,"While it is far from clear that this deal will be good for Canada, we know that Chinese billionaires have been very good to the Liberal Party of Canada at $1,500 per person cash for access fundraisers."
0000381,2017 02 02 0,0.470253,"Hon. Jane Philpott (Minister of Health, Lib.)",LIB,5,7,"Mr. Speaker, the approach of this government to drug policy is evidence-based, compassionate, collaborative, and comprehensive."
0000160,2017 09 27 9,0.470353,Hunter Tootoo,IND,5,5,"Mr. Speaker, my question is for the Prime Minister. "
0000503,2016 10 21 2,0.472544,"Ms. Gudie Hutchings (Parliamentary Secretary for Small Business and Tourism, Lib.)",LIB,5,6,"Small business operators wanted more customers, and that is what we have given them."
0000036,2017 12 01 5,0.472958,Mark Holland,LIB,6,6,"The committee proceedings are following detailed work that was done on the security and intelligence framework, and the most exhaustive consultations that happened on a national basis."
0000140,2017 10 05 9,0.472978,Joel Lightbound,LIB,6,7,We will always stand behind our entrepreneurs and the growth they create in this country.
0000286,2017 04 12 5,0.473779,"Right Hon. Justin Trudeau (Prime Minister, Lib.)",LIB,6,7," Again, this government remains focused on the things Canadians are talking to us about every day, right across the country: whether it is how we will secure retirement for their aging parents, we talk about strengthening the CPP and increasing the GIS; whether it is giving opportunities to young people, we talk about increasing the Canada student grant by 50% and giving young people better access to post-secondary education"
0000093,2017 10 30 2,0.474039,Helene Laverdiere,NDP,7,3,"When will this government do what it promised, what the UN has asked for, what the rest of the world expects from Canada and—"
0000187,2017 06 20 6,0.474991,Mark Strahl,CPC,7,3,"Why, when the wolves of Wall Street will not deal with this questionable company, did the Prime Minister rush headlong into approving this deal?"
0000601,2016 06 02 0,0.478257,"Mr. Alain Rayes (Richmond—Arthabaska, CPC)",CPC,7,3,The real question is this: will the Liberals try to change the rules of democracy to their advantage or are they trying out an agreement with the NDP rather than consulting Canadians directly through a referendum?
0000469,2016 11 16 8,0.479110,"Mme Anne Minh-Thu Quach (Salaberry—Suroît, NPD)",NDP,7,4,"Mr. Speaker, there is currently nothing stopping another wreck from docking in Beauharnois, for example."
0000587,2016 06 10 6,0.479748,"Hon. John McKay (Parliamentary Secretary to the Minister of National Defence, Lib.)",LIB,7,3,"Therefore, the question is based upon gossip and rumour, and wherever else the hon. member gets his source of information."
0000373,2017 02 07 2,0.482851,"Hon. Thomas Mulcair (Outremont, NDP)",NDP,7,2," Sorry, Mr. Speaker, but knowing a billionaire for a long time does not excuse the Prime Minister of breaking the law."
0000278,2017 05 02 7,0.483607,"Hon. Chrystia Freeland (Minister of Foreign Affairs, Lib.)",LIB,6,6,"Mr. Speaker, Canada is a steadfast friend and ally of Israel, as I was honoured to say at the World Jewish Congress in New York last week."
0000526,2016 10 06 5,0.483795,"Hon. Peter Kent (Thornhill, CPC)",CPC,7,3,"It is bad enough that the Liberals did not protest when China blocked Taiwan's usual observer role at the civil aviation meeting in Montreal, but how could the government remain silent when China blocked a Canadian citizen, a journalist, from covering that meeting, in Canada?"
0000570,2016 09 19 9,0.484267,"Mr. Rhéal Fortin (Rivière-du-Nord, BQ)",BQ,7,3,Is that what Liberal Canada looks like?
0000107,2017 10 25 6,0.485007,Julie Dabrusin,LIB,7,7,They chose our plan that helps people put a roof over their heads and healthy food on their tables.
0000556,2016 09 23 5,0.486338,Ms. Dianne L. Watts,CPC,6,4,Will the minister please tell Canadians exactly how many Liberal infrastructure projects have actual shovels in the ground and are under construction?
0000962,2015 03 09 1,0.486735,"Mr. Marc Garneau (Westmount—Ville-Marie, Lib.)",LIB,6,4, What is the government doing to respond to the deterioration of job quality?
0000420,2016 12 07 9,0.487458,"L’hon. Marc Garneau (ministre des Transports, Lib.)",LIB,6,4,"Mr. Speaker, I would rather not have to repeat myself, but our government and our Prime Minister know that the people of Lac-Mégantic were deeply traumatized by the 2013 disaster, which took the lives of 47 people."
0000256,2017 05 10 5,0.488827,Justin Trudeau,LIB,6,6,"  Mr. Speaker, I am very happy to work with the Conflict of Interest and Ethics Commissioner to answer any questions she may have."
0000053,2017 11 23 2,0.489735,Rachel Blaney,NDP,6,4,"Mr. Speaker, yesterday, the Liberal government finally announced its housing strategy—"
0000290,2017 04 12 9,0.490436,"Right Hon. Justin Trudeau (Prime Minister, Lib.)",LIB,5,6,We know that Canadian pressure and Canada being part of UNRWA allow us to ensure that the help is going to where it is needed and it is not creating negative consequences for Israel or for anyone else.
0000080,2017 11 07 9,0.491757,Joel Godin,CPC,6,3,"The Liberals are dangling tons of money before the municipalities, but some projects have been cancelled because of all of the unnecessary conditions being imposed."
0000579,2016 06 15 8,0.492380,"Hon. Ralph Goodale (Minister of Public Safety and Emergency Preparedness, Lib.)",LIB,5,4,"The applications that are made by police authorities need to be proportionate, they need to be justified on the grounds of the subject matter under investigation. "
0000166,2017 09 22 5,0.492745,Sherry Ramanado,LIB,5,7,"The Canadian Armed Forces recognizes the importance of actively looking to recruit candidates with different views, experiences, and skill sets needed to meet the needs of our members. "
0000557,2016 09 23 6,0.495562,"Ms. Cheryl Hardcastle (Windsor—Tecumseh, NDP)",NDP,7,3,"Therefore, why do the Liberals still sanction the use of information obtained through torture?"
0000300,2017 04 07 9,0.497154,"L’hon. Diane Lebouthillier (ministre du Revenu national, Lib.)",LIB,5,7,Our government increased the basic amount and the additional residency amount used in the calculation of the northern residence tax deduction.
0000973,2015 02 25 2,0.498579,"Mr. Randall Garrison (Esquimalt—Juan de Fuca, NDP)",NDP,6,3,"Open-ended surveillance and maintenance of these records is concerning for Canadians, especially given the weak oversight of security agencies like the Communications Security Establishment."
0000955,2015 03 12 4,0.498607,"Hon. Jason Kenney (Minister of National Defence and Minister for Multiculturalism, CPC)",CPC,5,4,"The member, and all members, have my assurance that I will review the report closely and work with the Provost Marshal of the Canadian Armed Forces to make whatever changes are necessary to ensure that the totally unacceptable conduct that occurred in this matter does not repeat itself."
0000398,2017 01 30 7,0.501517,"Ms. Georgina Jolibois (Desnethé—Missinippi—Churchill River, NDP)",NDP,6,4,Will the minister commit to ongoing funding so that northern youth are employed?
0000888,2015 05 12 7,0.501802,"Mme Annick Papillon (Québec, NPD)",NDP,6,4,"Mr. Speaker, that was in the budget, but Quebec City is still waiting to see whether the 2017 Tall Ships Regatta will finally get the money they were promised. "
0000406,2016 12 12 5,0.502305,"Mme Brenda Shanahan (Châteauguay—Lacolle, Lib.)",LIB,4,6,"Mr. Speaker, as promised in January, the government appointed four temporary members to the National Energy Board in order to meet a commitment to consult communities and indigenous groups to get as much feedback as possible on the proposed energy east project."
0000007,2017 12 13 6,0.503044,Justin Trudeau,LIB,5,6,We have improved the benefits they receive.
0000649,2016 05 09 8,0.506976,"Mr. Louis Plamondon (Bécancour—Nicolet—Saurel, BQ)",BQ,6,5,It urged the government to enforce the spirit and the letter of the cheese standards and to treat diafiltered milk as a dairy ingredient.
0000296,2017 04 07 5,0.509127,"Ms. Kim Rudd (Parliamentary Secretary to the Minister of Natural Resources, Lib.)",LIB,4,6,"Mr. Speaker, Canada's forestry sector is very important to our communities, and a stable and predictable market helps promote economic development and good jobs. "
0000714,2016 03 09 3,0.509879,"Hon. Denis Lebel (Lac-Saint-Jean, CPC)",CPC,6,6,"Mr. Speaker, after years of complacency by the former Liberal government, in 2006, our Conservative government signed a softwood lumber agreement with our American partners. "
0000872,2015 05 15 1,0.511910,"L’hon. Pierre Poilievre (ministre de l’Emploi et du Développement social et ministre de la Réforme démocratique, PCC)",CPC,6,7," We will continue to cut taxes to achieve success, such as the 1.2 million new jobs created."
0000299,2017 04 07 8,0.512562,"Mr. Martin Shields (Bow River, CPC)",CPC,4,4,"Eighty-two per cent of grain farmers depend on this tax deferral to help them mitigate uncertainties in grain farming, which can change greatly from year to year."
0000240,2017 05 18 9,0.513298,Jane Philpott,LIB,5,7,The money that we are giving to the provinces and territories is enough to entirely clear that waiting list.
0000806,2015 12 07 5,0.514173,"Mr. James Bezan (Selkirk—Interlake—Eastman, CPC)",CPC,6,3,Could the Minister of National Defence tell us what he is going to be cutting to make—
0000066,2017 11 20 5,0.514805,Kamal Khera,LIB,5,6,"We have added nurse practitioners to complete the applications of their patients, and we have just started."
0000497,2016 10 26 6,0.515524,"Hon. Pierre Poilievre (Carleton, CPC)",CPC,7,3,Why is the Prime Minister taxing away the opportunities of our youth?
0000865,2015 05 27 4,0.516468,"Mr. Dennis Bevington (Northwest Territories, NDP)",NDP,6,3,"Mr. Speaker, the Auditor General has shown that the nutrition north criteria are not fair or accessible."
0000472,2016 11 04 1,0.518112,"Ms. Ruth Ellen Brosseau (Berthier—Maskinongé, NDP)",NDP,6,3,"Our farmers are losing millions of dollars with every harvest, but that was to be expected."
0000603,2016 06 02 2,0.518283,"Hon. Maryam Monsef (Minister of Democratic Institutions, Lib.)",LIB,5,6,"Mr. Speaker, days ago I met, along with the Minister of Sport and Persons with Disabilities, with the Elections Canada advisory group on persons with disabilities."
0000241,2017 05 15 0,0.521047,Amarjeet Sohi,LIB,4,6,"There will be different layers of accountability, and due diligence will be done every step of the way when we engage with the infrastructure bank or with the private sector."
0001012,2015 01 28 1,0.521297,"Hon. Thomas Mulcair (Leader of the Opposition, NDP)",NDP,6,4,They are not allowed to accompany Iraqi forces to the front lines.
0000266,2017 05 05 5,0.521714,"Ms. Yvonne Jones (Parliamentary Secretary to the Minister of Indigenous and Northern Affairs, Lib.)",LIB,5,6,"Our goal is to make sure that we have clean drinking water in all indigenous communities by 2021 in Canada, and we are going to work hard to meet that goal."
0000292,2017 04 07 1,0.521984,"Hon. Diane Finley (Haldimand—Norfolk, CPC)",CPC,7,3,This is exactly what the Liberals are doing by giving $373 million of taxpayer money to Bombardier so it can pad its pockets with bonuses.
0000907,2015 04 24 6,0.522445,"Ms. Irene Mathyssen (London—Fanshawe, NDP)",NDP,7,3,Will the Conservatives reverse their destructive cuts to CFIA?
0000804,2015 12 07 3,0.522603,"Mr. Charlie Angus (Timmins—James Bay, NDP)",NDP,6,4,Could the minister tell us what her timeline is for an action plan and will that action plan have clear guidelines and commitments so we can get results for these communities?
0000905,2015 04 24 4,0.523073,"Mr. Frank Valeriote (Guelph, Lib.)",LIB,7,3,Why are the Conservatives so stubbornly refusing to present a plan that will honour our sacred obligation to veterans and all their families?
0000571,2016 06 15 0,0.523363,"Hon. Denis Lebel (Lac-Saint-Jean, CPC)",CPC,6,4,"We know that, but will an agreement finally be reached to help the economies of every province in the country?"
0000618,2016 05 20 7,0.523583,"Ms. Sheri Benson (Saskatoon West, NDP)",NDP,7,4,"Will the government commit to introducing proactive pay equity legislation within the next six months, yes or no?"
0000606,2016 06 02 5,0.524211,"Hon. Ralph Goodale (Minister of Public Safety and Emergency Preparedness, Lib.)",LIB,4,6,I thank the member for Kingston and the Islands for contributing to that goal.
0000318,2017 03 20 7,0.526075,"Ms. Anju Dhillon (Dorval—Lachine—LaSalle, Lib.)",LIB,5,5,Can the Minister of International Development and La Francophonie inform the House of the details of this major announcement?
0000162,2017 09 22 1,0.528568,Yvonne Jones,LIB,5,6,"Mr. Speaker, yesterday we had the opportunity to meet with the commissioners from the missing and murdered indigenous women inquiry in Canada and to hear first-hand from the commissioners about the work they are doing."
0000216,2017 06 06 5,0.530682,Michael Cooper,CPC,7,4,Every parent has a right to know if one of these predators is moving into his or her neighbourhood
0000397,2017 01 30 6,0.531548,"Hon. Jody Wilson-Raybould (Minister of Justice and Attorney General of Canada, Lib.)",LIB,4,6,"This is exactly what we are doing, working with the provinces and territories, working with stakeholders, and working with the steering committee, which is focused specifically on assisting us with bringing forward substantive solutions."
0000333,2017 02 24 2,0.531566,"Hon. Ralph Goodale (Minister of Public Safety and Emergency Preparedness, Lib.)",LIB,6,4,"How would that be good for the 400,000 people who cross that border every day?"
0000928,2015 04 01 7,0.533064,"Hon. Bernard Valcourt (Minister of Aboriginal Affairs and Northern Development, CPC)",CPC,6,3," Mr. Speaker, it is strange to see this member make this kind of accusation when at every step of the measures we have taken and are taking to improve and reduce the gaps between aboriginal and non-aboriginal Canadians, this party, the NDP, votes against each and every measure."
0000037,2017 12 01 6,0.534944,Joel Lightbound,LIB,6,7,"Mr. Speaker, I would also think that the some 20,000 children in my riding whose families receive more money through the Canada child benefit, which has lifted 300,000 kids out of poverty, would have the utmost confidence in the finance minister."
0000636,2016 05 12 5,0.535338,"Hon. Maryam Monsef (Minister of Democratic Institutions, Lib.)",LIB,6,6,It is time for a 21st century model of electing individuals to the House.
0000084,2017 11 02 3,0.535437,Lisa Raitt,CPC,6,4,Is there a senior government official over there who will actually say that there is no other minister in the same position he put himself in?
0000608,2016 06 02 7,0.536018,"Mr. Serge Cormier (Parliamentary Secretary to the Minister of Fisheries, Oceans and the Canadian Coast Guard, Lib.)",LIB,6,6,"That is what the minister pledged to do, and that is what he will do in the future."
0000517,2016 10 18 6,0.540218,"Mr. Romeo Saganash (Abitibi—Baie-James—Nunavik—Eeyou, NDP)",NDP,6,4,"Mr. Speaker, Inuit and their Innu supporters in Labrador are raising serious concerns about the impacts of flooding at Muskrat Falls. "
0000654,2016 05 04 3,0.540245,"Ms. Gudie Hutchings (Parliamentary Secretary for Small Business and Tourism, Lib.)",LIB,5,6,"Mr. Speaker, I am proud to rise in the House as a small business owner and operator in Newfoundland and Labrador for over 25 years"
0000624,2016 05 17 3,0.540606,"Mr. Alain Rayes (Richmond—Arthabaska, CPC)",CPC,6,4,Can the minister reassure us that she will do everything she can to convince the Prime Minister of Canada of the importance of holding a referendum to consult all Canadians?
0000425,2016 12 02 4,0.541105,"Mr. Joël Godin (Portneuf—Jacques-Cartier, CPC)",CPC,,,NA 
0000494,2016 10 26 3,0.542517,"Hon. Chrystia Freeland (Minister of International Trade, Lib.)",LIB,6,3,"Mr. Speaker, I am frankly astonished that the NDP cannot get behind a deal that has the full support of socialists across Europe."
0000731,2016 02 23 0,0.542722,"Hon. Rona Ambrose (Leader of the Opposition, CPC)",CPC,6,3,When is the Prime Minister going to understand that throwing borrowed money around does not create jobs?
0000014,2017 12 08 3,0.543119,Marjolaine Boutin-Sweet,NDP,7,3," Mr. Speaker, yesterday we learned that after the Liberals forced their visions for housing and health care on the provinces, they are now planning to change the equalization calculations, without even consulting the provinces."
0000531,2016 10 03 0,0.543655,"Right Hon. Justin Trudeau (Prime Minister, Lib.)",LIB,5,6,"Mr. Speaker, as members of the House all know, we are working very hard on this issue with the United States."
0000783,2016 01 25 2,0.544120,"Hon. Jim Carr (Minister of Natural Resources, Lib.)",LIB,5,6,"We are talking to Canadians now, and what comes after these consultations will be Canadians' confidence in delivering these resources to market in a sustainable way."
0000848,2015 06 04 7,0.547012,"Ms. Roxanne James (Parliamentary Secretary to the Minister of Public Safety and Emergency Preparedness, CPC)",CPC,7,4,"Mr. Speaker, again, we reject any claim that the RCMP did anything wrong by following the express will of Parliament, but it is interesting that the NDP continues to bring up this question, because the NDP, if ever given a chance, would bring that long gun registry back with everything else."
0000621,2016 05 17 0,0.547178,"Right Hon. Justin Trudeau (Prime Minister, Lib.)",LIB,7,3," Mr. Speaker, the uncertainty has been created by 10 years of a government that refused to understand that we can only build a strong economy when we are protecting the environment, when we are listening to Canadians, when we are building partnerships with indigenous peoples, and when we are respecting the science that surrounds all these projects."
0000169,2017 09 22 8,0.547395,Sean Casey,LIB,5,6,Those are tangible actions that support our artists without further taxing the middle class.
0000283,2017 04 12 2,0.548617,"Right Hon. Justin Trudeau (Prime Minister, Lib.)",LIB,6,7,"Mr. Speaker, we are proud to be following through on our commitment to strengthen the independence of the parliamentary budget officer; to make him or her a full officer of Parliament, accountable to the Speakers of the House and the Senate and not to the librarian of Parliament; to give him or her greater tools to access information to answer the questions parliamentarians may ask; and even, at the request of political parties, to evaluate political platforms to make sure Canadians know what they are getting when they vote for someone."
0000099,2017 10 30 8,0.549755,Ron Liepert,CPC,6,3,"Mr. Speaker, I will take that answer as a yes, that he did inappropriately use resources of the House of Commons and no, that he did not clear it with the Ethics Commissioner."
0000853,2015 06 01 2,0.550026,"Hon. John McCallum (Markham—Unionville, Lib.)",LIB,5,4,"This government introduced voluntary savings plans, but Canadians still do not have enough money for their retirement."
0000096,2017 10 30 5,0.550640,Marc Garneau,LIB,4,6,"Using a risk-based approach, we periodically conduct an airline safety audit. "
0000704,2016 03 21 3,0.553318,"Mr. Ben Lobb (Huron—Bruce, CPC)",CPC,5,4,They just need a little longer runway.
0000465,2016 11 16 4,0.554708,"Mr. Guy Caron (Rimouski-Neigette—Témiscouata—Les Basques, NDP)",NDP,5,4,"During the election campaign, the Liberals said, “Interest rates are at historic lows, our current infrastructure is aging rapidly....Now is the time to invest.”"
0000993,2015 02 17 2,0.556268,"Mr. Justin Trudeau (Papineau, Lib.)",LIB,5,4,"Furthermore, Mr. Harper cut the budget by 23%—"
0000294,2017 04 07 3,0.556350,"Hon. Catherine McKenna (Minister of Environment and Climate Change, Lib.)",LIB,6,3,"Mr. Speaker, unlike the party opposite, we understand that the environment and the economy go together. "
0000638,2016 05 12 7,0.556600,"Mr. Todd Doherty (Cariboo—Prince George, CPC)",CPC,6,6,"Mr. Speaker, it was the Conservative government that put an end to the longest and most costly trade disagreement in history with the softwood lumber agreement."
0000700,2016 04 11 9,0.557500,"Mr. Gabriel Ste-Marie (Joliette, BQ)",BQ,6,4,"Instead of announcing symbolic measures, will this government commit to seriously crack down on tax havens by abolishing the regulatory framework that helps them, yes or no?"
0000651,2016 05 04 0,0.557546,"Right Hon. Justin Trudeau (Prime Minister, Lib.)",LIB,6,6,We know that these are the types of investments that will boost economic growth and allow Canadians to get to work and get better jobs.
0000432,2016 11 29 1,0.558093,"Mr. Blaine Calkins (Red Deer—Lacombe, CPC)",CPC,6,4,The Cannabis Friendly Business Association paid the entrance fee and got their 10 minutes of face time with the parliamentary secretary to the Minister of Justice.
0000260,2017 05 10 9,0.558216,Justin Trudeau,LIB,6,6,People are very interested with the leadership that Canada is showing in terms of figuring out how to better protect our kids and pull away the profits from criminals and organized crime.
0000676,2016 04 19 5,0.560047,"Hon. Chrystia Freeland (Minister of International Trade, Lib.)",LIB,4,5,"I met with Jim Haney, who is the senior VP and GM of City National Bank, recently acquired by RBC."
0000453,2016 11 21 2,0.560479,"Hon. Chrystia Freeland (Minister of International Trade, Lib.)",LIB,5,5,"In opposition, I was our party's trade critic."
0000995,2015 02 17 4,0.561067,"Hon. Judy Sgro (York West, Lib.)",LIB,7,3,Does the minister agree that the only thing growing faster than GTA potholes is the Conservative addiction to lavish partisan ads?
0000620,2016 05 20 9,0.561162,"Ms. Monique Pauzé (Repentigny, BQ)",BQ,6,4,How many studies does the Minister of Agriculture and Agri-Foodneed just to require the AquAdvantage salmon to be labelled?
0000337,2017 02 24 6,0.561622,"Mrs. Karen McCrimmon (Parliamentary Secretary to the Minister of Transport, Lib.)",LIB,5,6,"That is the reason why the Minister of Transport met with various law enforcement officials to emphasize just how reckless this action is and to ask for the public's help when they see something like this happening, for them to call 911 and let police officials know. "
0000752,2016 02 05 1,0.561780,"Hon. K. Kellie Leitch (Simcoe—Grey, CPC)",CPC,6,4,"By including this funding as part of an anti-ISIS plan, is the Liberal government saying that the Israeli-Palestinian conflict is a root cause of the rise of ISIS?"
0000939,2015 03 27 8,0.562291,"Hon. Pierre Poilievre (Minister of Employment and Social Development and Minister for Democratic Reform, CPC)",CPC,6,6,"We are giving the dollars back to the more than eight million real child care experts who are out there, and their names are Mom and Dad."
0000031,2017 12 01 0,0.563315,Maximme Bernier,CPC,7,3,He does not even consult Canadians about his measures—
0000282,2017 04 12 1,0.563858,"Right Hon. Justin Trudeau (Prime Minister, Lib.)",LIB,6,3,We will not make inappropriate use of omnibus bills like the former government did.
0000879,2015 05 15 8,0.564665,"Ms. Lise St-Denis (Saint-Maurice—Champlain, Lib.)",LIB,6,7,"Mr. Speaker, for 40 years Quebec Native Women has been standing up for abused aboriginal women."
