Label,Video,Shuffle,Speaker,Party,Activation,Sentiment,englishHansard
0000863,2015 05 27 2,0.783365,"Hon. Kevin Sorenson (Minister of State (Finance), CPC)",CPC,5,4,What we will not do is reach into the pockets of Canadians with a mandatory payroll tax and take money out of their pockets.
0000359,2017 02 15 8,0.783368,"Hon. Catherine McKenna (Minister of Environment and Climate Change, Lib.)",LIB,6,6,"Mr. Speaker, I take very seriously the obligation to protect our natural environment. "
0000941,2015 03 24 0,0.784306,"Right Hon. Stephen Harper (Prime Minister, CPC)",CPC,6,3,"This group, the so-called Islamic State, represents a direct threat not just to the region."
0000063,2017 11 20 2,0.785031,Justin Trudeau,LIB,6,6,We on this side of the House have faith in the integrity of the commissioner's work.
0000078,2017 11 07 7,0.786517,Bill Morneau,LIB,6,7,"We have now passed 500,000 new jobs in the country since we were elected."
0000904,2015 04 24 3,0.788772,"Hon. K. Kellie Leitch (Minister of Labour and Minister of Status of Women, CPC)",CPC,5,3,The NDP totally opposed all those things.
0000501,2016 10 21 0,0.788810,"Hon. Navdeep Bains (Minister of Innovation, Science and Economic Development, Lib.)",LIB,5,6,"Madam Speaker, first and foremost, our thoughts go out to the workers and their families during this difficult time."
0000192,2017 06 13 1,0.789626,Thomas Mulcair,NDP,6,4," Mr. Speaker, I imagine the Prime Minister will have no trouble making public what the Americans did say in this case."
0000269,2017 05 05 8,0.790639,"Ms. Sheri Benson (Saskatoon West, NDP)",NDP,7,3,"If the government will not tell us when all the current cases will be resolved, can it at least tell us when it intends to stop creating new ones?"
0001015,2015 01 28 4,0.792472,"Mr. Justin Trudeau (Papineau, Lib.)",LIB,5,3,"Mr. Speaker, once again, with income splitting, the government will favour Canadians who earn over $233,000 per year. "
0000832,2015 06 09 1,0.792690,"Mr. Paul Calandra (Parliamentary Secretary to the Prime Minister and for Intergovernmental Affairs, CPC)",CPC,7,3,"There is only one taxpayer and whether it is a senator or whether it is a member of Parliament, there are 68 members of the NDP caucus who owe $2.7 million."
0000293,2017 04 07 2,0.793249,"Hon. Diane Finley (Haldimand—Norfolk, CPC)",CPC,7,3," If the Liberals will not demand accountability from Bombardier executives, how can taxpayers believe they will demand accountability for the loan?"
0000488,2016 10 31 7,0.794164,"Mr. Jacques Gourde (Lévis—Lotbinière, CPC)",CPC,7,3,How does the government not see that this is another conflict of interest?
0000552,2016 09 23 1,0.794895,"Mr. Jacques Gourde (Lévis—Lotbinière, CPC)",CPC,7,2,"This is a glaring lack of judgment on the part of the Prime Minister, but it is not surprising because we are finding more and more examples of public funds that have been squandered."
0000971,2015 02 25 0,0.796080,"Mr. Robert Goguen (Parliamentary Secretary to the Minister of Justice, CPC)",CPC,4,6,"Canadians have diverse viewpoints on this, and our plan is to engage all Canadians in a consultation process that will take into consideration the diverse viewpoints of all Canadians in order to reach a conclusion that is acceptable to everyone."
0000763,2016 02 02 2,0.796219,"Hon. Lisa Raitt (Milton, CPC)",CPC,6,3,"Maybe the Liberals should check their snapshot when they came in November, because I am pretty sure it was in the black, not in the red, where they will drag it after the end of this fiscal year."
0000220,2017 06 06 9,0.796786,Chrystia Freeland,LIB,7,2,"We condemn, in absolute terms, the human rights abuses of Canadians and all people anywhere in the world."
0000680,2016 04 19 9,0.797840,"Hon. Chrystia Freeland (Minister of International Trade, Lib.)",LIB,5,6,"In fact, the trade committee is currently in British Columbia consulting."
0000431,2016 11 29 0,0.798954,"Hon. Thomas Mulcair (Outremont, NDP)",NDP,5,4,"Let us say that someone convinces us they will stand firm in order to get our support, but once they have our support, they reverse their position."
0000828,2015 06 12 7,0.799168,"Mr. Andrew Saxton (Parliamentary Secretary to the Minister of Finance, CPC)",CPC,5,6, Our government has delivered on its promise to Canadians to make life more affordable and continue to lower taxes.
0000020,2017 12 08 9,0.800458,Arif Virani,Lib,5,6,"An inter-country adoption is often a long and complex process, and we understand the challenges that are faced by families. "
0000647,2016 05 09 6,0.801278,"Hon. Amarjeet Sohi (Minister of Infrastructure and Communities, Lib.)",LIB,4,5,"The buckets the member makes reference to were actually created by the previous government in multiple areas that we are actually trying to put together, so we can deliver results to Canadians in the way that Canadians expect us to do, to deliver the kind of infrastructure they need for public transit, for social housing, for green infrastructure, to build strong, sustainable communities."
0000625,2016 05 17 4,0.804716,"Hon. Carolyn Bennett (Minister of Indigenous and Northern Affairs, Lib.)",LIB,6,7,We believe that the historic investments for indigenous communities in budget 2016 and the generous and fair Canada child tax benefit will lift many children out of poverty.
0000667,2016 04 22 6,0.804902,"Hon. Hunter Tootoo (Minister of Fisheries, Oceans and the Canadian Coast Guard, Lib.)",LIB,7,4,"I would like to thank the member for her question, and I could not agree with her more; it was an issue that was totally ignored by the previous government. "
0000233,2017 05 18 2,0.805632,John Brassard,CPC,7,3,"When the Prime Minister gets back to Ottawa from his tour, will he be handing resumés over to the government House leader, Gerald Butts, and Katie Telford stacked in the order of the highest cheques given to the Liberal Party?"
0000280,2017 05 02 9,0.806772,"Hon. Jim Carr (Minister of Natural Resources, Lib.)",LIB,5,4,"We are taking it seriously, across the country, to do whatever we possibly can to soften the blow of these punitive and unwelcome tariffs."
0001018,2015 01 28 7,0.807285,"Mr. Matthew Dubé (Chambly—Borduas, NDP)",NDP,4,4,We need to improve this process.
0000568,2016 09 19 7,0.808155,"Hon. Jody Wilson-Raybould (Minister of Justice and Attorney General of Canada, Lib.)",LIB,5,6,"No decision has been made, but we are confident that we will appoint a diverse, functionally bilingual, high-calibre jurist to the Supreme Court of Canada."
0000407,2016 12 12 6,0.808430,"M. Gérard Deltell (Louis-Saint-Laurent, PCC)",CPC,7,3,Does it not realize that? Because Canadians certainly do.
0000326,2017 03 08 5,0.808575,"Hon. Michelle Rempel (Calgary Nose Hill, CPC)",CPC,5,4,"Mr. Speaker, we know that the funding to help many Syrian refugees resettle runs out this month. "
0000124,2017 10 17 3,0.810988,Ruth Ellen Brosseau,NDP,6,4,"For us, however, the protection of our supply management system is non-negotiable, and we will not allow it to be chipped away any further."
0000255,2017 05 10 4,0.811511,Justin Trudeau,LIB,7,5,It is extremely important that we work—
0000383,2017 02 02 2,0.812950,"Mr. Alexandre Boulerice (Rosemont—La Petite-Patrie, NDP):",NDP,6,4,Even the people who did the Liberals' survey want political parties to work together.
0000052,2017 11 23 1,0.814599,Ralph Goodale,LIB,4,5,"The House can expect to see at least three different initiatives coming forward in the weeks and months immediately ahead, to establish a new policy framework, to provide a strategy that is geared to the 21st century, and a suite of initiatives that will ensure that Canada can be a leader in the forefront of the rest of the world."
0000525,2016 10 06 4,0.814870,"Hon. John McCallum (Minister of Immigration, Refugees and Citizenship, Lib.)",LIB,5,5,"That said, someone whose citizenship has been revoked should have the opportunity to appeal that decision."
0000352,2017 02 15 1,0.814872,"Hon. Ahmed Hussen (Minister of Immigration, Refugees and Citizenship, Lib.)",LIB,5,6,I can assure the hon. member that all full-time employees will have their jobs available to them one hour away in Edmonton and the new location will have more immigration processing and more jobs.
0000800,2015 12 09 9,0.817533,"Mr. Xavier Barsalou-Duval (Pierre-Boucher—Les Patriotes—Verchères, BQ)",BQ,5,4," Mr. Speaker, on February 20, the Prime Minister promised the Board of Trade of Metropolitan Montreal that a Liberal government would immediately reinstate the tax credits for labour-sponsored funds in full."
0000365,2017 02 10 4,0.818320,"Ms. Yvonne Jones (Parliamentary Secretary to the Minister of Indigenous and Northern Affairs, Lib.)",LIB,5,6,"We are hoping that this inquiry will also make recommendations on urgent action that is needed, such as the known root causes, with investments in women's shelters, housing, education, and children across indigenous Canada."
0000190,2017 06 20 9,0.818517,Ahmed Hussen,LIB,6,7,"As a government, we responded to the largest refugee crisis in half a century by admitting 40,000 Syrian refugees. "
0000122,2017 10 17 1,0.818535,Bardish Chagger,LIB,4,5,This rate was 11% in 2015 and will be lowered to 9% by 2019.
0000253,2017 05 10 2,0.818766,Rona Ambrose,CPC,7,3,"Mr. Speaker, this is unbelievable."
0000990,2015 02 20 9,0.818855,"Mr. Claude Patry (Jonquière—Alma, BQ)",BQ,6,3,"Mr. Speaker, while the current Quebec government is hurting the regions by making ill-advised decisions to supposedly improve public finances, the fiscal imbalance between Ottawa and the provinces continues to grow."
0000221,2017 06 01 0,0.820815,Andrew Scheer,CPC,6,3,"However, when he actually has the chance to do some good for Canadian families, the answer is no."
0000710,2016 03 21 9,0.821131,"Mr. Jonathan Wilkinson (Parliamentary Secretary to the Minister of Environment and Climate Change, Lib.)",LIB,7,4,We have never said that energy projects will stop.
0000313,2017 03 20 2,0.822080,"Right Hon. Justin Trudeau (Prime Minister, Lib.)",LIB,6,7,"The fact is that, on Wednesday, everyone will see a budget focused on the growth of the middle class and on the assistance that Canadians so sorely need after 10 years of Conservative government."
0000068,2017 11 20 7,0.822385,Brigitte Sansoucy,NDP,6,4,This government has no deadline and the number of public servants affected keeps going up. 
0001006,2015 02 05 5,0.824923,"M. Emmanuel Dubourg (Bourassa, Lib.)",LIB,6,4,"Instead of governing, are the Conservatives already campaigning?"
0000273,2017 05 02 2,0.825273,Candice Bergen,CPC,6,4,"If our men and women in uniform try to steal valour and try to take credit for something that they did not do in the military, there is a consequence in terms of discipline, in terms of the trust that they will have lost with their colleagues."
0000529,2016 10 06 8,0.825491,"Hon. Ralph Goodale (Minister of Public Safety and Emergency Preparedness, Lib.)",LIB,6,8,This historic moment is testament to the courage and perseverance of the women who led this effort and the deep desire of all parties to move forward to ensure that all RCMP members have the safe and respectful work environment they deserve and that Canadians expect.
0000483,2016 10 31 2,0.825599,"Right Hon. Justin Trudeau (Prime Minister, Lib.)",LIB,6,7,"That is why we are so committed to working with indigenous peoples and with provinces and territories, municipalities, and partners to ensure that we are building a strong and resilient future for young people right across the country. "
0000126,2017 10 17 5,0.826944,Jean-Claude Poissant,LIB,6,3,I also said that the United States' proposals are unacceptable.
0001000,2015 02 17 9,0.827107,"Hon. Candice Bergen (Minister of State (Social Development), CPC)",CPC,5,7," Mr. Speaker, I would like to thank the member for Don Valley Eastfor the good work he is doing to support families in his riding."
0000034,2017 12 01 3,0.827228,Matthew Dube,NDP,5,4,"On another topic, yesterday, the Standing Committee on Public Safety and National Security met with the Minister of Public Safety only for one hour on a 138-page omnibus bill, Bill C-59."
0000534,2016 10 03 3,0.827255,"Right Hon. Justin Trudeau (Prime Minister, Lib.)",LIB,5,6,"I can highlight the Premier of Quebec, who just pointed out that our approach on carbon pricing respects provincial jurisdictions."
0000889,2015 05 12 8,0.828102,"Hon. Pierre Poilievre (Minister of Employment and Social Development and Minister for Democratic Reform, CPC)",CPC,7,3,The Liberals are really scrambling today after it having been revealed that there are billions of dollars in uncosted spending in their plan.
0000422,2016 12 02 1,0.829041,"Hon. Maryam Monsef (Minister of Democratic Institutions, Lib.)",LIB,5,7,"Some have already begun, inviting them to be part of this conversation, so that before we make any final recommendations on electoral reform, we have ensured that we have heard from as many Canadians as possible."
0000076,2017 11 07 5,0.829258,Andrew Nuttall,CPC,7,3, When will the Prime Minister stop treating hard-working Canadians like tax cheats and go after his own crew?
0000310,2017 03 23 9,0.830487,"Mr. Blaine Calkins (Red Deer—Lacombe, CPC)",CPC,7,3,"Even the most out-of-touch Hollywood celebrity would blush at this type of spending, and 17 hundred bucks to feed a family of five on a three hour flight."
0000859,2015 06 01 8,0.830674,"Hon. Steven Blaney (Minister of Public Safety and Emergency Preparedness, CPC)",CPC,7,7,I am proud to stand up with members who are supportive of preventing gang violence in Surrey with programs that have proven efficient and who work with the Government of British Columbia and the school board.
0000812,2015 06 17 1,0.830902,"Mr. Justin Trudeau (Papineau, Lib.)",LIB,6,3,Why does the Prime Minister refuse to acknowledge the importance of having judges who understand our two official languages?
0000902,2015 04 24 1,0.831092,"Mme Rosane Doré Lefebvre (Alfred-Pellan, NPD)",NDP,5,4,"Mr. Speaker, the Constitution states that for a senator to be appointed, “He shall be resident in the Province for which he is appointed.”"
0000974,2015 02 25 3,0.835669,"Hon. Steven Blaney (Minister of Public Safety and Emergency Preparedness, CPC)",CPC,5,7,"It is important to remember the measures that we have introduced, such as the legislation to combat terrorism, revoke passports and revoke the dual citizenship of individuals found guilty of terrorism, as well as Bill C-51, which is before us now."
0000860,2015 06 01 9,0.836374,"Hon. Chris Alexander (Minister of Citizenship and Immigration, CPC)",CPC,6,4,"We have been able to reduce backlogs everywhere, but there are some cases that are more complicated. They should be dealt with privately and not publicly in the House."
0001010,2015 02 05 9,0.836597,"Hon. Hedy Fry (Vancouver Centre, Lib.)",LIB,5,4,"Public health officers, health authorities, and municipalities have raised concerns with the minister."
0000754,2016 02 05 3,0.837603,"Mrs. Cheryl Gallant (Renfrew—Nipissing—Pembroke, CPC)",CPC,7,3,"Mr. Speaker, Hydro One will continue to gouge customers, especially seniors, while Brookfield, the parent company of Great Lakes Power, rakes in record profits on the backs of those on fixed incomes."
0000946,2015 03 24 5,0.840524,"Hon. Pierre Poilievre (Minister of Employment and Social Development and Minister for Democratic Reform, CPC)",CPC,6,6,"We on this side of the House are working to reduce taxes, boost training for in-demand jobs and sign free trade agreements that create demand for our Canadian products."
0000610,2016 06 02 9,0.840910,"Mr. Dan Albas (Central Okanagan—Similkameen—Nicola, CPC)",CPC,5,4,“We sell beer in all 50 states in the United States with pretty open borders and hopefully we'll get to that point in Canada soon.”
0000715,2016 03 09 4,0.841570,"Hon. Thomas Mulcair (Outremont, NDP)",NDP,6,3,What exactly did they mean by “immediately”?
0000514,2016 10 18 3,0.842205,"Mrs. Shannon Stubbs (Lakeland, CPC)",CPC,6,3,"The Liberals are imposing a harmful tax that will make food, diapers, formula, and everything even more expensive for everyone."
0001003,2015 02 05 2,0.842543,"Hon. James Moore (Minister of Industry, CPC)",CPC,7,3,"If the NDP does not understand that the Canadian Manufacturers & Exporters is the expert and that high taxes would kill jobs under the NDP's plan, then I guess we will all just have to live with our disappointment that the NDP just cannot learn."
0000251,2017 05 10 0,0.842854,Justin Trudeau,LIB,6,7,"That is why, in addition to our $180-billion infrastructure investment, we are looking at other ways to meet those needs and make things better for Canadians now and in the future."
0000089,2017 11 02 8,0.844799,Bill Morneau,LIB,6,6,We believe that it is important that we have an officer of Parliament who helps all of us here in the House to ensure that we can expose our personal assets and do it in a way that allows us to take recommendations on how we can assure that we do not have conflicts of interest.
0000519,2016 10 18 8,0.846480,"Ms. Kamal Khera (Parliamentary Secretary to the Minister of Health, Lib.)",LIB,5,6,"We launched a five-point action plan to address opioid misuse, and in November the Minister of Health will be hosting a summit on opioids, bringing together experts, patient groups, governments, and regulators to discuss the current crisis and identify actions moving forward."
0000378,2017 02 07 7,0.846573,"Hon. Harjit S. Sajjan (Minister of National Defence, Lib.)",LIB,6,6,"With any mission that we send our troops on, we are making sure we are going to have the right impact on the ground."
0000314,2017 03 20 3,0.848867,"Hon. Ginette Petitpas Taylor (Parliamentary Secretary to the Minister of Finance, Lib.)",LIB,5,6,"Mr. Speaker, my thanks to my colleague for his question."
0000061,2017 11 20 0,0.848956,Justin Trudeau,LIB,5,7,"Mr. Speaker, I am proud of the work that all members of the House of Commons have done to help us welcome hundreds of Yazidi women and children."
0000996,2015 02 17 5,0.849036,"Hon. Ed Fast (Minister of International Trade, CPC)",CPC,5,6,"Mr. Speaker, as I already mentioned, this government took the step of taking this dispute to the World Trade Organization, where we believe we will prevail."
0000135,2017 10 05 4,0.849491,Rachael Harder,CPC,5,5,"Mr. Speaker, Dina and Maurice are farmers in my riding."
0000934,2015 03 27 3,0.849540,"Mr. Adam Vaughan (Trinity—Spadina, Lib.)",LIB,6,4,They also do not get something else from the current government: infrastructure money. 
0001020,2015 01 28 9,0.850884,"Hon. Rob Nicholson (Minister of National Defence, CPC)",CPC,6,6,"The Liberals, in voting against all of these measures, probably missed all of this, but we are taking on an advise and assist role on the ground with the Iraqis, and we are conducting air strikes with our allies out of Kuwait."
0000873,2015 05 15 2,0.851434,"Mr. Marc Garneau (Westmount—Ville-Marie, Lib.)",LIB,8,2,"When the employment minister uses taxpayer money for self-promotion videos to get re-elected and then has the gall to say that he is merely informing Canadians about government policy, it is like a slap in the face to all Canadians who expect accountability."
0000023,2017 12 05 2,0.851450,Diane Lebouthillier,LIB,7,7,"As a social worker and as Minister of National Revenue, I have always worked on behalf of the most vulnerable people."
0000811,2015 06 17 0,0.853562,"Hon. Thomas Mulcair (Leader of the Opposition, NDP)",NDP,6,4,"Mr. Speaker, does the Prime Minister still believe that all senators meet the residency requirements to sit in the Senate?"
0000864,2015 05 27 3,0.854815,"Hon. Chris Alexander (Minister of Citizenship and Immigration, CPC)",CPC,8,3,"Mr. Speaker, it is pathetic to hear a New Democrat claim the Liberals' immigration policy was a model."
0000159,2017 09 27 8,0.855229,Andrew Scheer,CPC,6,3,"Mr. Speaker, hundreds of people across Atlantic Canada have been coming out to town halls and public consultations because they are legitimately concerned about the Prime Minister's own proposals."
0000048,2017 11 28 7,0.855534,Karine Trudel,NDP,7,2," If the government did not know what it was doing when it implemented Phoenix, how can we expect it to fix this disaster?"
0000141,2017 10 02 0,0.855605,Melanie Joly,LIB,5,6,"That being said, we need to protect and promote our creative industries in this digital age."
0000989,2015 02 20 8,0.855802,"Mr. John Williamson (New Brunswick Southwest, CPC)",CPC,5,6,Could the minister share with the House what we are doing to provide benefits for working Canadians?
0000725,2016 02 26 4,0.855909,"Hon. Catherine McKenna (Minister of Environment and Climate Change, Lib.)",LIB,7,7,"We need to take action on climate change, and we are going to take action, because it is the right thing to do, and it will also move us to a low carbon future, create new innovations, and new jobs."
0000183,2017 06 20 2,0.856425,Gerard Deltell,CPC,7,3,Wow. What a way to help society.
0000674,2016 04 19 3,0.856581,"Right Hon. Justin Trudeau (Prime Minister, Lib.)",LIB,4,5,We will not cancel an existing contract.
0000044,2017 11 28 3,0.858188,Candice Bergen,CPC,5,4,"However, 24 hours have passed and I am hoping the Prime Minister may have spoken with his finance minister."
0000777,2016 01 28 6,0.858628,"Hon. John McCallum (Minister of Immigration, Refugees and Citizenship, Lib.)",LIB,6,4,The tiny room I had in Lebanon was not safe....
0000181,2017 06 20 0,0.859808,Justin Trudeau,LIB,5,7,"Mr. Speaker, let me begin by thanking the member for his service to his community, to the House, and to all Canadians for many years."
0000391,2017 01 30 0,0.859909,"Right Hon. Justin Trudeau (Prime Minister, Lib.)",LIB,4,7,"That is why I was able to highlight the significant investments we are making in Canadians' future, defending Canadian jobs, building the jobs of tomorrow, working with Canadians to ensure that we have the skills to take on the challenges and the opportunities that are coming at us in the coming years. "
0000884,2015 05 12 3,0.860788,"Hon. Ed Fast (Minister of International Trade, CPC)",CPC,5,6,"Mr. Speaker, I can confirm that steps are being taken to bring this agreement into force."
0000500,2016 10 26 9,0.861644,"Hon. Amarjeet Sohi (Minister of Infrastructure and Communities, Lib.)",LIB,5,7,"That is why I am proud to say that, as of today, we have approved 72 projects, working in consultation with the municipalities and the province, with a total combined value of $3 billion to create jobs and prosperity for Albertans."
0000871,2015 05 15 0,0.863356,"Ms. Rosane Doré Lefebvre (Alfred-Pellan, NDP)",NDP,6,3,We share the intense sorrow of the families affected by this tragic event.
0000781,2016 01 25 0,0.864387,"Right Hon. Justin Trudeau (Prime Minister, Lib.)",LIB,6,7,"Mr. Speaker, I would like to thank the member opposite for her heartfelt words and indeed add to them personally that the entire government and indeed the country stands with the community of La Loche."
0000885,2015 05 12 4,0.871410,"Hon. Ed Fast (Minister of International Trade, CPC)",CPC,7,3,They have absolutely no credibility on trade.
0000195,2017 06 13 4,0.872589,Sean Casey,LIB,5,6,"Ms. Church has always been completely transparent about her former employer, including with the Conflict of Interest and Ethics Commissioner."
0000976,2015 02 25 5,0.873320,"Hon. Tony Clement (President of the Treasury Board, CPC)",CPC,6,4,"Every year, we table a budget which is good news for Canadians and every year the opposition votes against it."
0000157,2017 09 27 6,0.873406,Thomas Mulcair,NDP,7,3,The Canadian Human Rights Tribunal ordered the Prime Minister three times to put an end to the racial discrimination against first nations children.
0000795,2015 12 09 4,0.874372,"Mr. Alistair MacGregor (Cowichan—Malahat—Langford, NDP)",NDP,6,3,When will the government implement its promise to lift seniors out of poverty?
0000226,2017 06 01 5,0.874375,John Brassard,CPC,6,3,Will the minister do the right thing and finally admit how many times Madame Meilleur met with PMO staff and her staff before they gave their Liberal friend and donor this appointment?
0000172,2017 09 19 1,0.875391,Gerard Deltell,CPC,7,2,"Perhaps the Prime Minister looked at himself in the mirror in the morning before he said that, but the reality is that for real Canadian entrepreneurs, for small business owners who support hundreds of thousands of Canadians, it is arrogance, it is contempt."
0000936,2015 03 27 5,0.876133,"Ms. Linda Duncan (Edmonton—Strathcona, NDP)",NDP,8,2,"Will the minister, who has made this shameful, groundless insult to Alberta first nations, stand and apologize?"
0000634,2016 05 12 3,0.876408,"Hon. Maryam Monsef (Minister of Democratic Institutions, Lib.)",LIB,5,7,"This committee will be shaped by an important set of broad-based principles that include pursuing an effective and legitimate voting system which more accurately reflects Canadians' electoral wishes, a system that better engages all Canadians, one that fosters civility, consensus building, cohesion, an accessible system, one with integrity, and one that enhances the connection between representatives and their constituents."
0000205,2017 06 09 4,0.876744,Ralph Goodale,LIB,5,6,"Again, police and communities, working together—"
0000285,2017 04 12 4,0.877894,"Ms. Tracey Ramsey (Essex, NDP)",NDP,5,4,"Yesterday at the trade committee, the Minister of International Trade admitted that he has not had any talks with China about steel dumping, despite having embarked on a potential free trade agreement with China."
