Label,Shuffle,Speaker,Party,Activation,Sentiment,englishHansard
0000559,0.001262,"Hon. Jane Philpott (Minister of Health, Lib.)",LIB,5,3,There is no definitive medical test for thalidomide exposure.
0000859,0.002109,"Hon. Steven Blaney (Minister of Public Safety and Emergency Preparedness, CPC)",CPC,8,8,I am proud to stand up with members who are supportive of preventing gang violence in Surrey with programs that have proven efficient and who work with the Government of British Columbia and the school board.
0000595,0.003284,"Mr. François Choquette (Drummond, NDP)",NDP,7,2,"Mr. Speaker, today the Commissioner of Official Languages tabled a scathing report on Air Canada."
0000628,0.005361,"Hon. Jim Carr (Minister of Natural Resources, Lib.)",LIB,7,7,"Mr. Speaker, an independent group of distinguished western Canadians, all of whom will be known to those members, will, along with the regulator, assess the evidence that has been offered by Canadian people, evidence-based through the regulatory process, along with an assessment of upstream greenhouse gas emissions, along with meaningful consultation with indigenous communities, all of which must be in place if we are going to carry the confidence of Canadians."
0000535,0.005900,"M. François-Philippe Champagne (secrétaire parlementaire du ministre des Finances, Lib.)",LIB,7,7, I would say to my hon. colleague from Louis-Saint-Laurent that this government is acting like a responsible family man.
0000338,0.007503,"Hon. Ahmed Hussen (Minister of Immigration, Refugees and Citizenship, Lib.)",LIB,8,7,"Mr. Speaker, our government is proud of Canada's tradition of compassion toward those who are fleeing war and persecution."
0000048,0.008824,Karine Trudel,NDP,8,1," If the government did not know what it was doing when it implemented Phoenix, how can we expect it to fix this disaster?"
0000486,0.009430,"Mr. Charlie Angus (Timmins—James Bay, NDP)",NDP,7,2,The motion tomorrow specifically instructs the government to end the court cases against children who have been denied medical treatment. 
0000319,0.009449,"M. Pierre Paul-Hus (Charlesbourg—Haute-Saint-Charles, PCC)",CPC,7,3,"Now, Jean Boyle, a former general and the former vice president of international business at Boeing when the Super Hornet was being developed, is saying that NORAD will use its best planes, either the F-35 or the F-22, and not fourth generation jets like the Super Hornet, to protect the North."
0000827,0.010041,"Mr. Peter Braid (Parliamentary Secretary for Infrastructure and Communities, CPC)",CPC,6,7,"Of course, in our recent budget we announced the public transit fund."
0000498,0.010068,"Mr. Joël Godin (Portneuf—Jacques-Cartier, CPC)",CPC,6,3,but there has been no response from the Prime Minister.
0000028,0.012202,Diane Lebouthillier,LIB,6,8,"We will do so based on the principle of fairness for everyone who receives the disability tax credit, regardless of their disability."
0000791,0.012877,"Right Hon. Justin Trudeau (Prime Minister, Lib.)",LIB,6,8,"We encourage all members in the House to do that because it is a reflection of what Canadians asked for right across the country: investments in our future and in our communities, and help for the middle class by lowering taxes on the middle class and raising them for the wealthiest 1%."
0000520,0.013395,"Ms. Kamal Khera (Parliamentary Secretary to the Minister of Health, Lib.)",LIB,6,8,"That is exactly why the Minister of Health is sitting down with her provincial and territorial counterparts as we speak and collaborating with all our partners on health innovation, improved accessibility, and making prescription drugs more affordable for all Canadians."
0000996,0.013778,"Hon. Ed Fast (Minister of International Trade, CPC)",CPC,7,7,"Mr. Speaker, as I already mentioned, this government took the step of taking this dispute to the World Trade Organization, where we believe we will prevail."
0000583,0.013812,"Ms. Kamal Khera (Parliamentary Secretary to the Minister of Health, Lib.)",LIB,6,9,"Nearly 99% of pharmacy claims and 90% of the dental claims were approved, and more than 90% of the pharmacy claims were approved instantly at the point of the sale."
0000023,0.015212,Diane Lebouthillier,LIB,5,8,"As a social worker and as Minister of National Revenue, I have always worked on behalf of the most vulnerable people."
0000231,0.015520,Scott Brison,LIB,8,8,"Frankly, it is very important to continue to invest to stimulate economic growth and create jobs for the middle class across Canada."
0000332,0.015902,"Hon. Ahmed Hussen (Minister of Immigration, Refugees and Citizenship, Lib.)",LIB,6,8,"Mr. Speaker, our government is committed to maintaining a refugee system that maintains our tradition of providing compassion to those seeking safety and security in our country."
0000292,0.016154,"Hon. Diane Finley (Haldimand—Norfolk, CPC)",CPC,8,1,This is exactly what the Liberals are doing by giving $373 million of taxpayer money to Bombardier so it can pad its pockets with bonuses.
0000564,0.016413,"Mr. Mark Holland (Parliamentary Secretary to the Minister of Democratic Institutions, Lib.)",LIB,8,7,"I am very proud that more than 140 members of Parliament on this side of the House have either had, or will have in a very short while, town halls."
0000703,0.017438,"Mr. François-Philippe Champagne (Parliamentary Secretary to the Minister of Finance, Lib.)",LIB,8,7,"Mr. Speaker, I am very proud to say that the Minister of Financeand I went from coast to coast to coast to listen to Canadians."
0000308,0.018599,"Hon. Bill Morneau (Minister of Finance, Lib.)",LIB,5,6,We will consider ways of providing the necessary training for the good jobs of the future.
0000135,0.019559,Rachael Harder,CPC,5,5,"Mr. Speaker, Dina and Maurice are farmers in my riding."
0000857,0.020576,"Hon. Ed Fast (Minister of International Trade, CPC)",CPC,7,7," Mr. Speaker, the export contract that the member refers to is the largest in Canadian history and will create and sustain more than 3,000 direct jobs in southwestern Ontario alone."
0000930,0.021763,"M. François Pilon (Laval—Les Îles, NPD)",NDP,7,3,Will the government honour the City of Laval's request or will it plough ahead with the installation of community boxes?
0000896,0.022295,"Hon. John McKay (Scarborough—Guildwood, Lib.)",LIB,7,2,Will the current government advertise its $12-million cut for species at risk?
0000693,0.024363,"Hon. Dominic LeBlanc (Leader of the Government in the House of Commons, Lib.)",LIB,8,2,"As I have said on previous occasions, nobody on this side of the House has gone to prison for illegal fundraising, and that is something they are having trouble saying over there."
0000993,0.025917,"Mr. Justin Trudeau (Papineau, Lib.)",LIB,7,3,"Furthermore, Mr. Harper cut the budget by 23%—"
0000761,0.026073,"Right Hon. Justin Trudeau (Prime Minister, Lib.)",LIB,5,7,"It is actually important to follow up on them, give the tools to get things done, and execute them responsibly."
0000773,0.026544,"M. Andrew Scheer (Regina—Qu'Appelle, PCC)",CPC,7,3,"   Mr. Speaker, we cannot create jobs by inventing new barriers and new obstacles."
0000942,0.026634,"Right Hon. Stephen Harper (Prime Minister, CPC)",CPC,8,2,"I hear no compelling argument on the other side as to why we should completely ignore the very real threat to this country, which Canadians know exists."
0000143,0.027854,Bill Morneau,LIB,6,7,I have said that we will make sure that farmers are not negatively impacted. 
0000643,0.028622,"Hon. Candice Bergen (Portage—Lisgar, CPC)",CPC,7,2,They also need to know that the Minister of Natural Resourcesunderstands the serious implications of these oil productions being shut down.
0000614,0.028901,"Hon. Candice Bergen (Portage—Lisgar, CPC)",CPC,5,5,"Madam Speaker, yesterday, the National Energy Board recommended the Kinder Morgan pipeline project for approval."
0000823,0.030493,"Mr. Jonathan Genest-Jourdain (Manicouagan, NDP)",NDP,7,2,"In this case, the federal government clearly lacks political will, and the provinces are the ones showing the way. For example, Quebec recognized that residential schools were a form of cultural genocide against aboriginal nations. "
0000330,0.032648,"Ms. Elizabeth May (Saanich—Gulf Islands, GP)",GRN,7,10,"This has been brought into play by the bill I submitted in the 41st Parliament, unanimously supported in the House and the Senate, and continues to be strongly supported by members on all sides of this House."
0000171,0.033186,Thomas Mulcair,NDP,7,2," Obviously Canada is moving toward legalizing marijuana, and the NDP supports that, but the Liberals have left enormous gaps, and the bulk of the work is being left to the provinces"
0000596,0.034264,"Mr. François Choquette (Drummond, NDP)",NDP,7,3, Will the Liberals commit today to taking action to resolve this problem once and for all?
0000812,0.034441,"Mr. Justin Trudeau (Papineau, Lib.)",LIB,8,2,Why does the Prime Minister refuse to acknowledge the importance of having judges who understand our two official languages?
0000265,0.034625,"M. Joël Godin (Portneuf—Jacques-Cartier, PCC)",CPC,9,0,How can he continue to oversee the Department of National Defence after losing the respect of every member of the armed forces?
0000936,0.035196,"Ms. Linda Duncan (Edmonton—Strathcona, NDP)",NDP,9,1,"Will the minister, who has made this shameful, groundless insult to Alberta first nations, stand and apologize?"
0000649,0.037029,"Mr. Louis Plamondon (Bécancour—Nicolet—Saurel, BQ)",BQ,6,4,It urged the government to enforce the spirit and the letter of the cheese standards and to treat diafiltered milk as a dairy ingredient.
0000759,0.038600,"Mr. Greg Fergus (Parliamentary Secretary to the Minister of Innovation, Science and Economic Development, Lib.)",LIB,7,7,"owever, we recognize that the aerospace sector is a very important industry that relies heavily on exports and employs over 180,000 Canadians. It is very important—"
0000445,0.039548,"M. Pierre Paul-Hus (Charlesbourg—Haute-Saint-Charles, PCC)",CPC,8,0,"Combien de milliards de dollars — 4, 5, 6 ou 7 — les libéraux vont-ils brûler pour faire l'acquisition d'appareils inutiles?"
0000485,0.041192,"Mr. Charlie Angus (Timmins—James Bay, NDP)",NDP,8,2,"Mr. Speaker, with all due respect, reconciliation is not a hashtag. We are talking about a court order."
0000898,0.041486,"Mr. Randall Garrison (Esquimalt—Juan de Fuca, NDP)",NDP,7,1,"Now Stephen Toope, former dean of law at McGill, former UBC president, and currently the director of the Munk School of Global Affairs, has called Bill C-51:...so badly drafted, so expansive in scope, and so open to abuse that one must wonder how a responsible political leadership could bring it forward."
0000430,0.041583,"Hon. Marc Garneau (Minister of Transport, Lib.)",LIB,5,6,"Earlier this week, the government put out an RFP for a feasibility study on the possible use of event data recorders on commercial buses."
0000382,0.045247,"Hon. Jane Philpott (Minister of Health, Lib.)",LIB,6,8,"We will work together to address the opioid crisis in a manner that is comprehensive, evidence-based, and responds to the needs of Canadians."
0000166,0.045334,Sherry Ramanado,LIB,5,7,"The Canadian Armed Forces recognizes the importance of actively looking to recruit candidates with different views, experiences, and skill sets needed to meet the needs of our members. "
0000991,0.045411,"Right Hon. Stephen Harper (Prime Minister, CPC)",CPC,7,3,"Mr. Speaker, we believe that a large percentage of Quebeckers agree with our government on tax breaks, tax cuts, direct benefits to families and the fight against crime and terrorism, rather than with a party that wants to increase taxes, provides benefits to bureaucrats and unions, and does not take the fight against terrorists, jihadists and criminals seriously."
0000650,0.046075,"Hon. Jim Carr (Minister of Natural Resources, Lib.)",LIB,6,6,"  It is very clear to all Canadians the way in which we will proceed, which is principled with a predictability of timing and with meaningful consultation with aboriginal peoples."
0000924,0.046086,"Ms. Ève Péclet (La Pointe-de-l'Île, NDP)",NDP,7,2," The Information Commissioner was clear: “Although the Act was intended to shine a light on government decisions, it has become a shield against transparency and has encouraged a culture of delay.”"
0000576,0.047492,"Mr. Charlie Angus (Timmins—James Bay, NDP)",NDP,8,0,"Will the minister take responsibility for her office, and end this discriminatory and dangerous practice?"
0000076,0.049356,Andrew Nuttall,CPC,8,0, When will the Prime Minister stop treating hard-working Canadians like tax cheats and go after his own crew?
0000461,0.050716,"Hon. Rona Ambrose (Leader of the Opposition, CPC)",CPC,6,7,"NAFTA has created jobs, helped our economy grow, and provided market certainty to Canadian exporters for years."
0000914,0.051393,"Mr. Andrew Saxton (Parliamentary Secretary to the Minister of Finance, CPC)",CPC,8,0,"The Liberal leader's same old high-tax, high-debt agenda is perhaps underpinned by his position that a budget can simply balance itself. "
0000079,0.051842,Nathan Cullen,NDP,7,2,For years they fought against the release of the so-called tax gap in Canada.
0000835,0.053230,"Hon. Pierre Poilievre (Minister of Employment and Social Development and Minister for Democratic Reform, CPC)",CPC,7,2,"They are proposing a new $1,000 payroll tax on every single worker in Canada. "
0000957,0.054557,"Mr. Murray Rankin (Victoria, NDP)",NDP,8,1,When will the government give up its unjustifiable attack on Canadian charities?
0000510,0.054590,"Hon. Jody Wilson-Raybould (Minister of Justice and Attorney General of Canada, Lib.)",LIB,6,9,"What we have done is institute an open and transparent process for judicial appointments and, unprecedentedly, have put online application forms wherein anyone can apply to be on the Judicial Advisory Committee."
0000765,0.055659,"Mr. James Bezan (Selkirk—Interlake—Eastman, CPC)",CPC,7,3,"Mr. Speaker, yesterday the defence minister said our past military activity was a mistake."
0000324,0.055793,"L’hon. Bardish Chagger (leader du gouvernement à la Chambre des communes et ministre de la Petite Entreprise et du Tourisme, Lib.)",LIB,6,8,"We are going to keep working for Canadians every day, and I encourage the member to work with us so that we can get more done together."
0000067,0.056238,Carla Qualtrough,LIB,7,1,"While the previous government spent $309 million on the systems, booked savings of $70 million a year, and let go of hundreds of employees in order to falsely balance its budget—"
0000633,0.058620,"Hon. Steven Blaney (Bellechasse—Les Etchemins—Lévis, CPC)",CPC,7,1,Is the minister trying to engage in some sort of political sleight-of-hand in order to lead Canadians astray?
0000591,0.060341,"Mr. Blake Richards (Banff—Airdrie, CPC)",CPC,8,2,"Politicians making the decision, or will the minister actually drop the talking points and leave this decision directly in the hands of Canadians through a referendum?"
0000987,0.060908,"Mrs. Carol Hughes (Algoma—Manitoulin—Kapuskasing, NDP)",NDP,8,1," Will the minister recognize this crisis and work with these communities so they get the protection they need and deserve, or will the government continue to turn a blind eye and continue to put people at risk?"
0000122,0.061902,Bardish Chagger,LIB,5,6,This rate was 11% in 2015 and will be lowered to 9% by 2019.
0000745,0.062531,"Mr. Phil McColeman (Brantford—Brant, CPC)",CPC,6,3,"If not, what was the point of the mandate letter?"
0000327,0.062883,"Hon. Michelle Rempel (Calgary Nose Hill, CPC)",CPC,7,0,How much will the government pay in Canadian taxpayers' dollars to support its ill-fated refugee plan?
0000126,0.063319,Jean-Claude Poissant,LIB,6,3,I also said that the United States' proposals are unacceptable.
0000732,0.064093,"Hon. Bill Morneau (Minister of Finance, Lib.)",LIB,5,7,We will invest and this ratio will grow at a lower rate than in the past 10 years.
0000492,0.065307,"Mr. Blaine Calkins (Red Deer—Lacombe, CPC)",CPC,7,3,The Prime Minister's own rules clearly state ministers should not grant preferential access to stakeholders.
0000844,0.065706,"Hon. John McCallum (Markham—Unionville, Lib.)",LIB,7,2,"Will the government confront this new reality, bring in a new fiscal update before this session ends, and most important, come up with a real plan for jobs and growth?"
0000432,0.065867,"Mr. Blaine Calkins (Red Deer—Lacombe, CPC)",CPC,7,3,The Cannabis Friendly Business Association paid the entrance fee and got their 10 minutes of face time with the parliamentary secretary to the Minister of Justice.
0000624,0.069462,"Mr. Alain Rayes (Richmond—Arthabaska, CPC)",CPC,7,3,Can the minister reassure us that she will do everything she can to convince the Prime Minister of Canada of the importance of holding a referendum to consult all Canadians?
0000709,0.069843,"Mr. Geng Tan (Don Valley North, Lib.)",LIB,6,4,"Mr. Speaker, with the CETA agreement, started by the previous government, stalled since September 2014, I was thrilled to learn that our government was able to get the talks back on track for signature and implementation next year."
0000489,0.070284,"Hon. Bardish Chagger (Leader of the Government in the House of Commons and Minister of Small Business and Tourism, Lib.)",LIB,5,7,Those rules are open and transparent.
0000296,0.070801,"Ms. Kim Rudd (Parliamentary Secretary to the Minister of Natural Resources, Lib.)",LIB,5,8,"Mr. Speaker, Canada's forestry sector is very important to our communities, and a stable and predictable market helps promote economic development and good jobs. "
0000433,0.072223,"Hon. Carolyn Bennett (Minister of Indigenous and Northern Affairs, Lib.)",LIB,6,3,"Given the significant impact the decision could have on the independent assessment process, the government decided to—"
0000496,0.078457,"Hon. Amarjeet Sohi (Minister of Infrastructure and Communities, Lib.)",LIB,7,10,"Mr. Speaker, I am proud of the unprecedented level of co-operation we have with the Federation of Canadian Municipalities and the big city mayors."
0000741,0.082405,"Hon. Rona Ambrose (Leader of the Opposition, CPC)",CPC,7,2,"Instead, the Prime Minister is refusing to support energy east."
0000609,0.082613,"Mr. Serge Cormier (Parliamentary Secretary to the Minister of Fisheries, Oceans and the Canadian Coast Guard, Lib.)",LIB,6,4,"The commissioner recommended screening measures for the minister's office, and the minister will recuse himself from any discussion or decision involving Mr. Irving and his businesses."
0000582,0.083022,"Hon. John McKay (Parliamentary Secretary to the Minister of National Defence, Lib.)",LIB,6,2,"Today, we are risk-managing a gap between our NORAD commitments and our NATO commitments, in part because we inherited a bit of a mess from the previous government. "
0000093,0.083087,Helene Laverdiere,NDP,7,2,"When will this government do what it promised, what the UN has asked for, what the rest of the world expects from Canada and—"
0000340,0.083451,"Hon. Hunter Tootoo (Nunavut, Ind.)",IND,2,5," Mr. Speaker, my question is for the Prime Minister."
0000293,0.084535,"Hon. Diane Finley (Haldimand—Norfolk, CPC)",CPC,7,0," If the Liberals will not demand accountability from Bombardier executives, how can taxpayers believe they will demand accountability for the loan?"
0000077,0.086507,Marilyn Gladu,CPC,7,0,When will the minister finally tell her tax collectors to lay off sick and vulnerable Canadians and focus on real tax cheats?
0000543,0.087786,"Right Hon. Justin Trudeau (Prime Minister, Lib.)",LIB,7,1," Mr. Speaker, after 10 years under the reign of a government with the worst record in economic growth since R. B. Bennett and the Great Depression, Canadians needed a government that was ready to invest in their communities and ready to put more money in the pockets of the middle class by asking more of the wealthy."
0000855,0.088089,"Mr. Charlie Angus (Timmins—James Bay, NDP)",NDP,7,2, We are on the eve of a new Auditor General report that could put 14 senators in jail.
0000954,0.091148,"Hon. Diane Finley (Minister of Public Works and Government Services, CPC)",CPC,6,0,It is unfortunate that the NDP voted against this program that has benefited virtually all of their constituents.
0000544,0.091381,"Right Hon. Justin Trudeau (Prime Minister, Lib.)",LIB,6,8,That is why we are working with the provinces and our partners in industry to ensure that we reduce our greenhouse gas emissions.
0000016,0.091796,Jean-Yves Duclos,LIB,6,10,We have been working very hard over the past two years to make a number of benefits more flexible and more generous.
0000712,0.093409,"Hon. Rona Ambrose (Leader of the Opposition, CPC)",CPC,7,3,"Mr. Speaker, tonight, the Prime Minister is going to be in Washington with his pals at the Center for American Progress. "
0000509,0.095958,"Ms. Kate Young (Parliamentary Secretary to the Minister of Transport, Lib.)",LIB,6,7,We will take the necessary action on the findings to enhance marine safety in Canada.
0000854,0.096619,"Hon. Steven Blaney (Minister of Public Safety and Emergency Preparedness, CPC)",CPC,6,8,"While training and procurement are matters that fall under the direct purview of the RCMP, our government supports Canada's law enforcement agencies with legislative tools, resources like we find in budget 2015, that the member could support, which they need to get the job done, fighting crime and ensuring the safety and security of our communities."
0000769,0.097336,"Hon. Carolyn Bennett (Minister of Indigenous and Northern Affairs, Lib.):  ",LIB,6,7,We will work with first nations and achieve the goal of transparency and accountability with them.
0000378,0.097378,"Hon. Harjit S. Sajjan (Minister of National Defence, Lib.)",LIB,6,7,"With any mission that we send our troops on, we are making sure we are going to have the right impact on the ground."
0000189,0.097981,Pierre Paul-Hus,CPC,7,1,"For the past year, the opposition, experts, and the military have been telling the government to stop misleading Canadians with the unnecessary purchase of 18 Super Hornets. "
0000310,0.098184,"Mr. Blaine Calkins (Red Deer—Lacombe, CPC)",CPC,7,1,"Even the most out-of-touch Hollywood celebrity would blush at this type of spending, and 17 hundred bucks to feed a family of five on a three hour flight."
0000454,0.098228,"Hon. Chrystia Freeland (Minister of International Trade, Lib.)",LIB,7,0,"What astonishes me is that the NDP, which was able to support a trade agreement with South Korea, finds itself in 2016 unable to support the world's most progressive trade agreement."
0000032,0.099287,Ruth Ellen Brosseau,NDP,5,4,"Yesterday, the Liberals released the names of their picks for the positions of official languages and lobbying commissioner. "
0000349,0.100130,"Mr. James Bezan (Selkirk—Interlake—Eastman, CPC)",CPC,7,1,"With escalating Russian aggression, our Ukrainian allies are concerned that the Liberals have turned their backs on them again. "
0000550,0.100555,"Hon. Lawrence MacAulay (Minister of Agriculture and Agri-Food, Lib.)",LIB,7,10,Last week was a great week for Canadian agriculture.
0000080,0.102241,Joel Godin,CPC,7,2,"The Liberals are dangling tons of money before the municipalities, but some projects have been cancelled because of all of the unnecessary conditions being imposed."
0000393,0.103331,"Mr. Blaine Calkins (Red Deer—Lacombe, CPC)",CPC,8,0,"Mr. Speaker, it has come to the Prime Minister's attention that the Prime Minister has been breaking the Prime Minister's own ethical rules, so now the Prime Minister is creating new rules for the Prime Minister to follow so that the Prime Minister will no longer appear to be breaking the Prime Minister's rules. "
0000770,0.103364,"Hon. Judy Foote (Minister of Public Services and Procurement, Lib.)",LIB,6,7,"Mr. Speaker, the government takes the health and safety of all of its workers seriously and, in fact, of any visitors to our buildings. "
0000049,0.103779,Navdeep Bains,LIB,5,10,"We support work-integrated learning, which is why we invested $221 million to create more workplace opportunities in science, technology, engineering, mathematics, and in business programs."
0000090,0.103923,Wayne Stetski,NDP,6,4,"As the government moves to legalize the recreational use of cannabis, will it stand with and support economically important, small-scale outdoor farmers across Canada and ensure that they have a future, yes or no?"
0000123,0.104987,Lisa Raitt,CPC,7,2,He made the choice to attack hard-working Canadian entrepreneurs while protecting his own personal wealth. 
0000528,0.105438,"Hon. Ginette Petitpas Taylor (Moncton—Riverview—Dieppe, Lib.)",LIB,6,4,Can the Minister of Public Safety update the House on the status of the two class action lawsuits filed by the current and former women who have worked within the RCMP?
0000562,0.107156,"Mr. Mark Strahl (Chilliwack—Hope, CPC)",CPC,7,0,"Why are the Liberals so intent on threatening British Columbia families with their made-in-Ottawa, job-killing carbon tax?"
0000372,0.107848,"Right Hon. Justin Trudeau (Prime Minister, Lib.)",LIB,6,9,"We also increased the guaranteed income supplement by $1,000 for the most vulnerable seniors."
0000631,0.107913,"Hon. Jason Kenney (Calgary Midnapore, CPC)",CPC,7,2,Why will the current Liberal government not follow the provincial precedent of a referendum on electoral reform?
