Label,Shuffle,Speaker,Party,Activation,Sentiment,englishHansard
0000897,0.683365,"Mr. Kevin Lamoureux (Winnipeg North, Lib.)",LIB,5,4,"Tragically, about 25 police and firefighters die in the line of duty, on average, every year. "
0000748,0.684704,"Hon. Candice Bergen (Portage—Lisgar, CPC)",CPC,7,3,Folks in New Brunswick and Quebec are offended that foreign oil is being given better treatment than Canadian oil.
0000374,0.685675,"Hon. Thomas Mulcair (Outremont, NDP)",NDP,6,4,"  Mr. Speaker, the billionaire class and those hoping to join the billionaire class."
0000075,0.687563,Luc Berthold,CPC,6,3,"In the same interview, he said that the goal was to raise a pile of money to help the Liberal leader become the next prime minister. "
0000740,0.690134,"L'hon. Dominic LeBlanc (leader du gouvernement à la Chambre des communes, Lib.)",LIB,6,5,"Mr. Speaker, when we want advice on conflict of interest matters, we go directly to the Conflict of Interest and Ethics Commissioner, Ms. Dawson,"
0000906,0.691066,"Ms. Irene Mathyssen (London—Fanshawe, NDP)",NDP,6,3," Mr. Speaker, Ontario farmers are worried because avian flu has been confirmed on a second farm in Oxford County, and the quarantine now stretches into the Waterloo Region."
0000684,0.691104,"Ms. Linda Duncan (Edmonton Strathcona, NDP)",NDP,7,2,"Mr. Speaker, the Minister of Transport claims rail safety is his top priority, yet this week rail inspectors told our committee, despite a projected tenfold increase in dangerous cargo, that the rail safety budget was being slashed 21%."
0000601,0.691268,"Mr. Alain Rayes (Richmond—Arthabaska, CPC)",CPC,7,3,The real question is this: will the Liberals try to change the rules of democracy to their advantage or are they trying out an agreement with the NDP rather than consulting Canadians directly through a referendum?
0000159,0.691814,Andrew Scheer,CPC,7,3,"Mr. Speaker, hundreds of people across Atlantic Canada have been coming out to town halls and public consultations because they are legitimately concerned about the Prime Minister's own proposals."
0000360,0.692432,"Hon. Jane Philpott (Minister of Health, Lib.): ",LIB,6,8,This initiative together with others shows that our government is fully implementing Jordan's principle.
0000243,0.692748,Blaine Calkins,CPC,7,2,Is it maybe Dalton McGuinty as the ethics commissioner or Kathleen Wynne as the lobbying commissioner? 
0000547,0.693018,"Mr. Don Davies (Vancouver Kingsway, NDP)",NDP,7,2,"Will the Liberals abandon Stephen Harper's funding cuts, quit using Conservative talking points, and negotiate fairly with the provinces to protect Canada's public health care system?"
0000420,0.694215,"L’hon. Marc Garneau (ministre des Transports, Lib.)",LIB,6,6,"Mr. Speaker, I would rather not have to repeat myself, but our government and our Prime Minister know that the people of Lac-Mégantic were deeply traumatized by the 2013 disaster, which took the lives of 47 people."
0000089,0.694960,Bill Morneau,LIB,6,7,We believe that it is important that we have an officer of Parliament who helps all of us here in the House to ensure that we can expose our personal assets and do it in a way that allows us to take recommendations on how we can assure that we do not have conflicts of interest.
0000495,0.699149,"Hon. John McKay (Parliamentary Secretary to the Minister of National Defence, Lib.)",LIB,5,5,"Mr. Speaker, as you know, the Canadian Forces are engaged in an anti-ISIL coalition."
0000459,0.701777,"Mr. John Brassard (Barrie—Innisfil, CPC)",CPC,6,3,Many of our veterans have testified about suffering long-lasting and life-altering side effects after using this drug.
0000963,0.701807,"Mr. Charlie Angus (Timmins—James Bay, NDP)",NDP,7,1,"Let us stick on the issue here, because not only are Conservative insiders being subpoenaed, but last week we learned that a number of key Conservative MPs have been called to testify."
0000395,0.702499,"Hon. Candice Bergen (House Leader of the Official Opposition, CPC)",CPC,7,1,"As we saw from Jacques Corriveau's sentencing last week, the Liberals have a history of breaking the rules."
0001005,0.702554,"Mr. Guy Caron (Rimouski-Neigette—Témiscouata—Les Basques, NDP)",NDP,6,3," Mr. Speaker, over the past two years, the Conservatives have spent $1.6 million on promoting Canadian oil in the United States."
0000158,0.702960,Justin Trudeau,LIB,8,0,"The fact is that we should all be outraged, and remain outraged, that Canadian governments violated a Canadian's fundamental rights."
0000030,0.703515,Harjitt S. Sajjan,LIB,7,8,"In terms of the timeline that it has taken, the interim gap that needs to be filled, Davie shipyard is building that interim capability gap, and we thank them for that service."
0000469,0.705712,"Mme Anne Minh-Thu Quach (Salaberry—Suroît, NPD)",NDP,6,3,"Mr. Speaker, there is currently nothing stopping another wreck from docking in Beauharnois, for example."
0000475,0.706410,"M. Pierre Paul-Hus (Charlesbourg—Haute-Saint-Charles, PCC)",CPC,6,2,The government is about to send our soldiers to Mali to play social worker and talk to extremists. 
0000472,0.707076,"Ms. Ruth Ellen Brosseau (Berthier—Maskinongé, NDP)",NDP,7,2,"Our farmers are losing millions of dollars with every harvest, but that was to be expected."
0000152,0.708169,Justin Trudeau,LIB,5,8,We are going to focus on helping Canadians—
0000165,0.708674,Steven Blaney,CPC,6,3,Will the minister confirm that veteran Westholm was canned because he was critical of the Liberal government inaction?
0000414,0.708787,"Hon. Candice Bergen (Portage—Lisgar, CPC)",CPC,7,2," Is there anyone on that side of the House who has the courage to stand up for what is right, and tell the Prime Minister to stop this corrupt fundraising?"
0000654,0.710017,"Ms. Gudie Hutchings (Parliamentary Secretary for Small Business and Tourism, Lib.)",LIB,6,8,"Mr. Speaker, I am proud to rise in the House as a small business owner and operator in Newfoundland and Labrador for over 25 years"
0000949,0.710437,"Ms. Joyce Murray (Vancouver Quadra, Lib.)",LIB,7,0,"In the meantime she has no income, she is about to lose her housing, and she is still not receiving the benefits she is entitled to."
0000768,0.711543,"Hon. Lawrence MacAulay (Minister of Agriculture and Agri-Food, Lib.)",LIB,6,7,"Mr. Speaker, the government is engaged with industry stakeholders on the outcome of the TPP."
0000402,0.711961,"Mme Ruth Ellen Brosseau (Berthier—Maskinongé, NPD)",NDP,7,2,"Meanwhile, the Prime Minister just clearly confirmed that not only was government business discussed but that he is the one who deems whether it is appropriate or not."
0000555,0.712058,"Hon. Bardish Chagger (Leader of the Government in the House of Commons and Minister of Small Business and Tourism, Lib.)",LIB,6,0,"  Mr. Speaker, the office of the previous prime minister, Stephen Harper, approved more than $300,000 in moving expenses, including $93,000 for one person—"
0000878,0.712979,"Mr. Rick Norlock (Northumberland—Quinte West, CPC)",CPC,6,9, Our government wants to help all Canadian families succeed by keeping taxes low and delivering programs like the universal child care benefit and family tax cut.
0000813,0.713216,"Right Hon. Stephen Harper (Prime Minister, CPC)",CPC,6,3,"Mr. Speaker, once again, as those who have investigated this have said that I am neither a participant nor a witness to any of these events, there is absolutely no reason why I would be before the court."
0000347,0.714156,"Hon. Ralph Goodale (Minister of Public Safety and Emergency Preparedness, Lib.)",LIB,6,7,"As Commissioner Paulson told the hon. member earlier today, the RCMP, the CBSA, the IRCC, and other Canadian agencies are working seamlessly and relentlessly together to achieve the objectives of border integrity and public safety."
0000088,0.714268,Shannon Stubbs,CPC,7,0,"Instead of insulting MPs and insinuating that female elected representatives cannot do math, why does the finance minister not just come clean and answer the questions?"
0000226,0.714613,John Brassard,CPC,7,2,Will the minister do the right thing and finally admit how many times Madame Meilleur met with PMO staff and her staff before they gave their Liberal friend and donor this appointment?
0000276,0.716079,"Hon. Pierre Poilievre (Carleton, CPC): ",CPC,6,3,"Has the government calculated how much taxpayers could lose if a market correction causes home prices to go down, or higher interest rates cause mortgage defaults to go up?"
0000312,0.716220,"Hon. Thomas Mulcair (Outremont, NDP)",NDP,6,3,Their plan also seems to include the privatization of Canadian airports. 
0000679,0.718834,"Hon. Jane Philpott (Minister of Health, Lib.)",LIB,5,4,"Mr. Speaker, I would agree with my hon. colleague that Canadians do not have access to high-quality palliative care in a manner that is acceptable."
0000399,0.719123,"Hon. Patty Hajdu (Minister of Employment, Workforce Development and Labour, Lib.)",LIB,7,10,"That is why we are investing historic amounts into ensuring that young people have the diversity of skills to bring forward new ideas, new talent, and new creativity to the emerging workforces of Canada."
0000409,0.719533,"Hon. Jane Philpott (Minister of Health, Lib.)",LIB,6,8,We will work with all provinces and territories to promote vaccination.
0000290,0.719671,"Right Hon. Justin Trudeau (Prime Minister, Lib.)",LIB,6,8,We know that Canadian pressure and Canada being part of UNRWA allow us to ensure that the help is going to where it is needed and it is not creating negative consequences for Israel or for anyone else.
0000203,0.721367,Bardish Chagger,LIB,6,9,"We have put in a new process, an open, transparent, merit-based process. All positions that are available are posted online."
0000724,0.721400,"Hon. Ed Fast (Abbotsford, CPC)",CPC,7,0,"Mr. Speaker, we know that Liberal deficits are skyrocketing, balanced budgets are out the window, and the Prime Ministercontinues to spend on foreign climate change projects that are costing Canadians billions of dollars."
0000455,0.721927,"Hon. Amarjeet Sohi (Minister of Infrastructure and Communities, Lib.)",LIB,6,4,"Mr. Speaker, while we are focused on creating jobs for the middle class and growing the economy for hard-working Canadians, what are the opposition members focused on? "
0000739,0.723441,"M. Jacques Gourde (Lévis—Lotbinière, PCC)",CPC,7,2,How can the Prime Minister justify this obvious conflict of interest?
0000250,0.723779,Jim Carr,LIB,5,6,The proposed near surface disposal facility at the Chalk River site would house low and intermediate level materials to ensure they are safe in long-term storage.
0000672,0.727422,"Right Hon. Justin Trudeau (Prime Minister, Lib.)",LIB,7,8,"Indeed, we will continue to respect contracts signed, because people around the world need to know that, when Canada signs a deal, it is respected."
0000448,0.731894,"Hon. Jim Carr (Minister of Natural Resources, Lib.)",LIB,7,7,We have been speaking from the moment this government came to power about the importance of developing our credible regulatory process and giving proponents of these projects some certainty.
0000371,0.734015,"Hon. Rona Ambrose (Leader of the Opposition, CPC)",CPC,7,4,He will not rule out the possibility of reducing the age amount and cancelling pension income splitting.
0000440,0.734566,"Hon. Navdeep Bains (Minister of Innovation, Science and Economic Development, Lib.)",LIB,7,9,"In London and other communities across the country, we are making significant investments and creating conditions for growth."
0000179,0.734979,Bill Morneau,LIB,7,10,That is a really good situation. 
0000062,0.735177,Justin Trudeau,LIB,7,8,We will always work with her to ensure that Canadians can have confidence in the work she does and in the work we do in the House to be worthy of Canadians' trust.
0000386,0.737269,"Hon. Amarjeet Sohi (Minister of Infrastructure and Communities, Lib.)",LIB,6,9,"Since doing that, we have approved 1,200 projects, with a combined investment of $14 billion. "
0000488,0.737622,"Mr. Jacques Gourde (Lévis—Lotbinière, CPC)",CPC,6,2,How does the government not see that this is another conflict of interest?
0000092,0.738297,Andrew Scheer,CPC,6,4," Once again, who are they?"
0000178,0.738813,Bill Morneau,LIB,6,10,"Mr. Speaker, our economy is humming along. We are in a very good position."
0000880,0.739640,"Mr. Gary Schellenberger (Perth—Wellington, CPC)",CPC,6,4,Can the Parliamentary Secretary to the Prime Minister update this House on what infrastructure initiative our government is launching to mark this occasion?
0000910,0.741130,"Ms. Roxanne James (Parliamentary Secretary to the Minister of Public Safety and Emergency Preparedness, CPC)",CPC,6,7,"Mr. Speaker, our government is focused on ensuring that our shared border is secure, while easing the flow of legitimate travel and trade."
0000341,0.742598,"Ms. Hélène Laverdière (Laurier—Sainte-Marie, NDP)",NDP,7,2,"The Prime Ministerclearly told refugees that Canada would welcome them, but he is refusing to put his money where his mouth is."
0000780,0.745038,"Hon. Maryam Monsef (Minister of Democratic Institutions, Lib.)",LIB,6,9,"The new independent, non-partisan, merit-based, open and transparent process we have introduced is in the capable hands of nine of eminent Canadians who make up the advisory board, individuals like Dr. Dawn Lavell-Harvard, president of the Native Women's Association of Canada. "
0000513,0.745052,"Hon. Chrystia Freeland (Minister of International Trade, Lib.)",LIB,6,9,"Manuel Valls, the socialist Prime Minister of France, described the deal as balanced, win-win, and mutually beneficial."
0000086,0.745997,Gerard Deltell,CPC,6,2,"The Liberal government is introducing a bill on access to information that would prevent the excellent work of journalists, people like Daniel Leblanc and others, from revealing things like the sponsorship scandal."
0000336,0.749409,"Hon. Jean-Yves Duclos (Minister of Families, Children and Social Development, Lib.)",LIB,7,10,"Mr. Speaker, I am pleased to have this opportunity to speak a bit about the agenda we have for seniors, a very strong agenda, and not only for this generation of seniors, many of whom are being taken out of poverty through the increase in the guaranteed income supplement and the lowering of the age of eligibility to 65 years—100,000 seniors will not need to enter into severe poverty—but also through the enhancement of the Canada pension plan, which is going to take 300,000 future seniors out of income vulnerability."
0000442,0.749586,"Mr. Kevin Lamoureux (Parliamentary Secretary to the Leader of the Government in the House of Commons, Lib.)",LIB,7,2,"In fact, I would refer to, whether it is the New Democrats, or the Conservatives, where they have had to pay back monies."
0000339,0.750605,"Hon. Catherine McKenna (Minister of Environment and Climate Change, Lib.)",LIB,7,9,"I am listening and I am prepared to work with my federal colleagues, the City of Quebec, the province, and the staff at Parks Canada in order to ensure that the public and anyone who is interested can access the artifacts in a timely manner."
0000566,0.751226,"M. Mark Holland (secrétaire parlementaire de la ministre des Institutions démocratiques, Lib.)",LIB,6,8,"Je veux encourager le Parti conservateur à participer, avec les autres partis et avec le Parti libéral, aux consultations partout au Canada pour améliorer notre système."
0000487,0.752202,"M. Gérard Deltell (Louis-Saint-Laurent, PCC)",CPC,7,2," The government's plan is not working, so what is it going to do to help small businesses, which create wealth and jobs?"
0000922,0.753833,"Right Hon. Stephen Harper (Prime Minister, CPC)",CPC,7,2,The NDP voted against the automotive innovation fund for the auto industry and against the national shipbuilding procurement strategy—
0000948,0.755225,"Mr. Andrew Cash (Davenport, NDP)",NDP,7,0,The fact is that Conservatives have repeatedly and systematically made it more difficult for immigrants to become citizens. 
0000272,0.757150,Harjit Sajjan,LIB,6,8,We have conducted a thorough analysis on our defence policy review and it will do just that.
0000546,0.757933,"Mr. Blaine Calkins (Red Deer—Lacombe, CPC)",CPC,6,7,"He also stated that they go over, extensively, the personalized cash payouts with each employee."
0000912,0.760647,"Mr. Charlie Angus (Timmins—James Bay, NDP)",NDP,6,3,"Mr. Speaker, former Senate law clerk Mark Audcent has testified that it was the business of the Prime Minister's Office to vet Senate appointees to see if they were actually eligible to sit in the Senate. "
0000471,0.761342,"Hon. Denis Lebel (Lac-Saint-Jean, CPC)",CPC,6,1,"In October, Canada lost 23,000 full-time jobs because of the government's decisions."
0000869,0.762754,"Mr. Jeff Watson (Parliamentary Secretary to the Minister of Transport, CPC)",CPC,6,5,"Transport Canada, in the situation of the airbags, has received no complaints related to this issue from Canadians and is not aware of any incidents having taken place in Canada."
0000904,0.762879,"Hon. K. Kellie Leitch (Minister of Labour and Minister of Status of Women, CPC)",CPC,7,1,The NDP totally opposed all those things.
0000263,0.764815,"Mr. Marc Miller (Parliamentary Secretary to the Minister of Infrastructure and Communities, Lib.)",LIB,6,8,"The infrastructure bank, let us be clear, is only $15 billion out of more than a $180-billion transformational plan. "
0000221,0.765542,Andrew Scheer,CPC,7,2,"However, when he actually has the chance to do some good for Canadian families, the answer is no."
0000553,0.766245,"Hon. Catherine McKenna (Minister of Environment and Climate Change, Lib.)",LIB,7,10,Our government is committed to ensuring that all federal services are provided in accordance with the Official Languages Act.
0000537,0.767126,"Hon. Ralph Goodale (Minister of Public Safety and Emergency Preparedness, Lib.)",LIB,6,6,"On that point, we have invited Canadians to review that part of that ministerial directive and give us their advice on whether or not those present terms and the offences around them are acceptable."
0000986,0.767189,"Mrs. Carol Hughes (Algoma—Manitoulin—Kapuskasing, NDP)",NDP,7,1,These communities experience major response time delays that can have devastating and tragic impacts.
0000335,0.768267,"Mr. Mark Strahl (Chilliwack—Hope, CPC)",CPC,7,1,"While it is far from clear that this deal will be good for Canada, we know that Chinese billionaires have been very good to the Liberal Party of Canada at $1,500 per person cash for access fundraisers."
0000462,0.771074,"Hon. Marie-Claude Bibeau (Minister of International Development and La Francophonie, Lib.)",LIB,7,7,"This is why, after conducting meaningful oversight and negotiating an agreement that includes robust control measures, I announced today that Canada is providing $25 million in funding to UNRWA for their security and development, but also for the stability of the region."
0000700,0.771739,"Mr. Gabriel Ste-Marie (Joliette, BQ)",BQ,8,3,"Instead of announcing symbolic measures, will this government commit to seriously crack down on tax havens by abolishing the regulatory framework that helps them, yes or no?"
0000753,0.772203,"Mrs. Cheryl Gallant (Renfrew—Nipissing—Pembroke, CPC)",CPC,6,4,What plans does the FedNor minister have to conduct open public consultations and public hearings as part of the Competition Act review of this transaction?
0000428,0.773312,"Mr. Fin Donnelly (Port Moody—Coquitlam, NDP)",NDP,7,0,Open net salmon farms are literal death traps for marine mammals.
0000063,0.773521,Justin Trudeau,LIB,7,4,We on this side of the House have faith in the integrity of the commissioner's work.
0000916,0.773867,"Mr. Adam Vaughan (Trinity—Spadina, Lib.)",LIB,6,2,"Mr. Speaker, during the debate yesterday we learned that in the middle of a disastrous oil spill in Vancouver, nobody in the federal government thought it was necessary to contact Vancouver city hall. "
0000876,0.775469,"Mr. Paul Dewar (Ottawa Centre, NDP)",NDP,6,3," Mr. Speaker, no one disagrees with the idea of the memorial, but what is with the high-handed attitude of the government?"
0000736,0.776020,"Hon. Kevin Sorenson (Battle River—Crowfoot, CPC)",CPC,6,7,"When the global recession hit, we provided a low-tax plan and economic stimulus, infrastructure, and other things to keep Canadians working. "
0000026,0.776249,Jean-Yves Duclos,LIB,7,10,"This year is a special year, because we are introducing Canada's volunteer awards for past and present winners who have given and will be giving their valuable time to support our communities."
0000831,0.780199,"Ms. Megan Leslie (Halifax, NDP)",NDP,6,0,"Mr. Speaker, trying to cover up Senate scandals has become routine for the Prime Minister's Office: watering down an internal Senate report and a $90,000 cheque for Senator Duffy."
0000045,0.780544,Kristy Duncan,LIB,6,8,Mr. Speaker our government is committed to creating open spaces for Canadians to debate and express their views.
0000536,0.782332,"Hon. Michelle Rempel (Calgary Nose Hill, CPC)",CPC,7,1,"When will the member for Calgary Centre, and I would love to see him answer this question, start doing his job in cabinet and stop the Prime Minister, who is making a bad situation even worse?"
0000291,0.783431,"Hon. Bardish Chagger (Leader of the Government in the House of Commons and Minister of Small Business and Tourism, Lib.)",LIB,6,7,"Mr. Speaker, this government was elected on a commitment to Canadians to modernize the way this place worked and to bring it into the 21st century."
0000774,0.783840,"Right Hon. Justin Trudeau (Prime Minister, Lib.)",LIB,6,7,"Therefore, we will be signing it as a way to consider it through ratification."
0000473,0.783994,"Mr. Serge Cormier (Parliamentary Secretary to the Minister of Fisheries, Oceans and the Canadian Coast Guard, Lib.)",LIB,6,8,"Mr. Speaker, I would like to start by reassuring the marine industry, the St. Lawrence Seaway Management Corporation, and all users of the Seaway that the Coast Guard takes icebreaking operations very seriously and provides exemplary service."
0000353,0.785113,"Mr. Blaine Calkins (Red Deer—Lacombe, CPC)",CPC,8,0,"When will the Prime Minister admit that he broke the law, and finally answer Canadians' questions about his unethical behaviour?"
0000843,0.785227,"Mr. Mark Strahl (Parliamentary Secretary to the Minister of Aboriginal Affairs and Northern Development, CPC)",CPC,6,8,"We are committed to ensuring that northerners, like all Canadians, have access to nutritious food."
0000531,0.787292,"Right Hon. Justin Trudeau (Prime Minister, Lib.)",LIB,6,8,"Mr. Speaker, as members of the House all know, we are working very hard on this issue with the United States."
0000457,0.787564,"Mr. Guy Caron (Rimouski-Neigette—Témiscouata—Les Basques, NDP)",NDP,6,4,"As Michael Sabia, a government adviser, has previously said, investors in this infrastructure bank will want to see a 7% to 9% return."
0000444,0.788124,"Mr. John Brassard (Barrie—Innisfil, CPC)",CPC,8,0,"All of us know that Ontario is broke, but why are Canadian taxpayers paying for Kathleen Wynne's public relations bills?"
0000967,0.789564,"Hon. Jason Kenney (Minister of National Defence and Minister for Multiculturalism, CPC)",CPC,6,7,These dangerous narcotics would have otherwise landed on our streets and in our communities.
0000726,0.789848,"Mr. Bill Blair (Parliamentary Secretary to the Minister of Justice and Attorney General of Canada, Lib.)",LIB,6,6,"Until a new and stronger regulatory regime can be put in place, we must rely on all existing laws to protect our communities and keep our communities safe."
0000733,0.790192,"Hon. Thomas Mulcair (Outremont, NDP)",NDP,7,3,"On exactly what authority can a Prime Minister relieve Air Canada of its legal obligations, which are very clear under the terms of a piece of Canadian legislation that is still in force? "
0000173,0.792780,Kevin Sorenson,CPC,6,4,"Farmers often mortgage their homes, their home quarter, and their land in order to expand, innovate, and create jobs for the local rural community."
0000532,0.793349,"Right Hon. Justin Trudeau (Prime Minister, Lib.)",LIB,8,9,"That is why we are so pleased to once again be discussing the health care system with the provinces, coming up with solutions, and respecting the provinces and their ability to meet the needs of all Canadians."
0000871,0.793868,"Ms. Rosane Doré Lefebvre (Alfred-Pellan, NDP)",NDP,8,2,We share the intense sorrow of the families affected by this tragic event.
0000466,0.794744,"Hon. Carolyn Bennett (Minister of Indigenous and Northern Affairs, Lib.)",LIB,6,3,  I cannot deal with something that is before the courts but I do understand that there was a public meeting where the member did see that information.
0001020,0.795013,"Hon. Rob Nicholson (Minister of National Defence, CPC)",CPC,6,6,"The Liberals, in voting against all of these measures, probably missed all of this, but we are taking on an advise and assist role on the ground with the Iraqis, and we are conducting air strikes with our allies out of Kuwait."
0000328,0.795825,"Ms. Linda Lapointe (Rivière-des-Mille-Îles, Lib.)",LIB,6,7,"Mr. Speaker, on March 2, the Minister of International Development and La Francophonie said, “Sexual and reproductive health and rights are human rights."
0000755,0.796274,"Hon. Marc Garneau (Minister of Transport, Lib.)",LIB,6,7,That is the proper approach for this government to take.
0000809,0.796461,"Hon. Chrystia Freeland (Minister of International Trade, Lib.)",LIB,6,7,"We are in their corner, and if we have to retaliate we will."
