Label,Shuffle,Speaker,Party,Activation,Sentiment,englishHansard
0000569,0.236738,"Hon. Harjit S. Sajjan (Minister of National Defence, Lib.)",LIB,6,9,"We are going to be going in with eyes wide open, making sure that we have all the necessary information to allow the military to do its work, as well as the Minister of Foreign Affairs and the Minister of International Development."
0000398,0.236953,"Ms. Georgina Jolibois (Desnethé—Missinippi—Churchill River, NDP)",NDP,7,4,Will the minister commit to ongoing funding so that northern youth are employed?
0001002,0.240129,"Ms. Rosane Doré Lefebvre (Alfred-Pellan, NDP)",NDP,7,2,"Mr. Speaker, on the Conservative's new security bill, Canadians have more questions than answers about whether these new powers are necessary, or even what they do."
0000515,0.240338,"Hon. Bill Morneau (Minister of Finance, Lib.)",LIB,7,6,"Mr. Speaker, I would encourage the hon. member to speak to some of the Albertans that she is speaking about, because she would find that they have actually had a reduction in taxes this year, which has gone to help their families—"
0000133,0.242427,Chrystia Freeland,LIB,6,6,"It is worth reminding people, particularly our American interlocutors, that the United States has a very great surplus in dairy trade with Canada of 5:1, and that is what I do at the negotiating table."
0000299,0.242866,"Mr. Martin Shields (Bow River, CPC)",CPC,6,6,"Eighty-two per cent of grain farmers depend on this tax deferral to help them mitigate uncertainties in grain farming, which can change greatly from year to year."
0000696,0.243926,"Mr. Gérard Deltell (Louis-Saint-Laurent, CPC)",CPC,4,7,"With respect to job creation, it says in the budget that 146,000 new jobs will be preserved."
0000223,0.244274,Andrew Scheer,CPC,6,3,It is also just a coincidence that two of her former employees now work for the Minister of Canadian Heritage.
0000017,0.245141,Todd Doherty,CPC,7,4,"Mr. Speaker, since day one, we have been challenging the government to make securing a new softwood agreement its number one trade priority."
0000895,0.247353,"Mr. James Bezan (Parliamentary Secretary to the Minister of National Defence, CPC)",CPC,6,9,"As to the Auditor General's report, National Defence accepts all the recommendations from the Auditor General's investigation. "
0000146,0.248143,John Barlow,CPC,7,4,Will the finance minister make those calls?
0000424,0.248588,"Ms. Marilyn Gladu (Sarnia—Lambton, CPC)",CPC,9,0,"Why is the Prime Minister willing to sell out Canada to the Chinese to raise money for the Liberals, and when will he put an end to these cash for access fundraisers?"
0000554,0.248694,"Mr. Joël Godin (Portneuf—Jacques-Cartier, CPC)",CPC,8,0,"Now that we know that the Prime Minister made a mistake when he authorized his friends' expenses, can the Minister of Foreign Affairs confirm that he also showed bad judgment?"
0000851,0.248875,"Hon. Bernard Valcourt (Minister of Aboriginal Affairs and Northern Development, CPC)",CPC,6,10,The government will continue to fulfill its obligations as set out in the agreement.
0000108,0.249221,Peter Kent,CPC,7,0,"Mr. Speaker, the United Nations Educational, Scientific and Cultural Organization has, for decades, been a petri dish of corruption, financial mismanagement, and political bias."
0000456,0.249783,"Ms. Rachel Blaney (North Island—Powell River, NDP)",NDP,7,3,Why is it so determined to sell it off?
0000047,0.250055,Joel Lightbound,LIB,6,3,"Under the Conservatives, not only was it taxable, but it was also sent to all families, regardless of income."
0000309,0.250450,"Hon. Bardish Chagger (Leader of the Government in the House of Commons and Minister of Small Business and Tourism, Lib.)",LIB,4,5,She has seen a lot of the stuff that has taken place here. 
0000615,0.253152,"Ms. Kim Rudd (Parliamentary Secretary to the Minister of Natural Resources, Lib.)",LIB,5,7,"We have asked that the panel members travel the pipeline route to hear from and talk to indigenous peoples and local communities, and report back to the minister by November 1, for a decision on or before December—"
0001015,0.253833,"Mr. Justin Trudeau (Papineau, Lib.)",LIB,6,2,"Mr. Speaker, once again, with income splitting, the government will favour Canadians who earn over $233,000 per year. "
0000600,0.258518,"L’hon. Mélanie Joly (ministre du Patrimoine canadien, Lib.)",LIB,6,9,"That is why I will work with my colleague, the Minister of Transport, on this issue, to ensure that the recommendations of the Commissioner of Official Languages will be examined."
0000042,0.259362,Pierre Poilievre,CPC,6,3,"Mr. Speaker, yesterday John Ivison indicated that he received some documents showing that the sale of the 680,000 shares by the minister would have happened on December 3"
0000734,0.260440,"Hon. Thomas Mulcair (Outremont, NDP)",NDP,8,2,"As unemployment goes up and the number of Canadians receiving EI benefits actually does down, Canadians are demanding action to help families pay the bills and to put food on the table."
0000782,0.260462,"Right Hon. Justin Trudeau (Prime Minister, Lib.)",LIB,7,7,"We were elected on a platform to invest in Canada to ensure a stronger future, create the growth that has been lacking for 10 years now, and create jobs for the middle class and all those who want to join it."
0000961,0.264253,"Mr. Marc Garneau (Westmount—Ville-Marie, Lib.)",LIB,7,0," According to the CIBC's analysis, job quality in Canada is the lowest it has been in the 15 years that the bank has been collecting statistics."
0000443,0.264315,"Mr. John Brassard (Barrie—Innisfil, CPC)",CPC,8,2,"Now we learn that the federal Liberals paid over $23,000 for public relations services for Kathleen Wynne's recent trip to Israel."
0000220,0.264653,Chrystia Freeland,LIB,9,7,"We condemn, in absolute terms, the human rights abuses of Canadians and all people anywhere in the world."
0000960,0.264803,"Ms. Manon Perreault (Montcalm, Ind.)",IND,6,2,"With Bill C-51, the government is overlooking key safety issues and sidestepping other serious problems."
0000484,0.265043,"Right Hon. Justin Trudeau (Prime Minister, Lib.)",LIB,7,9,"That is why we have made historic investments of $8.4 billion in budget 2016, and that is why we recognize there is much more to do and why we are going to continue working on that."
0000824,0.265166,"Mr. Mark Strahl (Parliamentary Secretary to the Minister of Aboriginal Affairs and Northern Development, CPC)",CPC,7,8,"It was our Prime Minister who set up the Truth and Reconciliation Commission, which reported just last week."
0000674,0.267106,"Right Hon. Justin Trudeau (Prime Minister, Lib.)",LIB,6,5,We will not cancel an existing contract.
0000652,0.269482,"Mr. Phil McColeman (Brantford—Brant, CPC)",CPC,7,2,"Mr. Speaker, the credibility of the Minister of Finance took another big hit this week when he admitted that he does not care about this whole balanced budget thing."
0000556,0.269591,Ms. Dianne L. Watts,CPC,7,3,Will the minister please tell Canadians exactly how many Liberal infrastructure projects have actual shovels in the ground and are under construction?
0000007,0.272488,Justin Trudeau,LIB,5,10,We have improved the benefits they receive.
0000306,0.273950,"Hon. Bardish Chagger (Leader of the Government in the House of Commons and Minister of Small Business and Tourism, Lib.)",LIB,6,8,Our government knows that the work members do here in the House and in their ridings is important. 
0000066,0.275078,Kamal Khera,LIB,6,8,"We have added nurse practitioners to complete the applications of their patients, and we have just started."
0000303,0.275962,"Hon. Bardish Chagger (Leader of the Government in the House of Commons and Minister of Small Business and Tourism, Lib.)",LIB,6,7,"Mr. Speaker, the discussion paper that I shared with members of Parliament as well as Canadians was to encourage us to have a conversation, a discussion. "
0000315,0.277919,"L’hon. Mélanie Joly (ministre du Patrimoine canadien, Lib.)",LIB,6,7,"  Of course, we launched public consultations last year to consider all the repercussions that digital services have on the entire Canadian cultural ecosystem."
0000585,0.280506,"Mr. Serge Cormier (Parliamentary Secretary to the Minister of Fisheries, Oceans and the Canadian Coast Guard, Lib.)",LIB,4,10,The panel meetings have been very well attended.
0000346,0.281733,"M. Gérard Deltell (Louis-Saint-Laurent, PCC)",CPC,8,2,"Will he, yes or no, impose more taxes on Canadians and job creators, the creators of wealth, the entrepreneurs?"
0000404,0.283028,"M. François-Philippe Champagne (secrétaire parlementaire du ministre des Finances, Lib.)",LIB,7,6,"My colleague is well aware that his constituents, like mine, will be protected under this new regime, and we will continue to work with the Senate on this issue."
0000483,0.283786,"Right Hon. Justin Trudeau (Prime Minister, Lib.)",LIB,7,10,"That is why we are so committed to working with indigenous peoples and with provinces and territories, municipalities, and partners to ensure that we are building a strong and resilient future for young people right across the country. "
0000657,0.284817,"Mr. Blaine Calkins (Red Deer—Lacombe, CPC)",CPC,7,2,She booked first-class flights to LA from Manila when she had a free ride home on the government jet.
0000899,0.285978,"Mr. Jasbir Sandhu (Surrey North, NDP)",NDP,8,1, Will the Conservatives stop making excuses and make funds available to protect the people in my community?
0000356,0.285980,"Mr. T.J. Harvey (Tobique—Mactaquac, Lib.)",LIB,7,3,Could the Parliamentary Secretary to the Minister of Agriculture and Agri-Food please inform the House on what he is doing to support youth in agriculture across this country?
0000249,0.287516,Jim Carr,LIB,8,7,We will vigorously defend our industry and our workers from the impacts of this decision by the U.S. commerce department.
0000721,0.288228,"Hon. Jason Kenney (Calgary Midnapore, CPC)",CPC,6,0,All of that means fewer jobs and lower income.
0000261,0.288733,"Hon. Candice Bergen (Portage—Lisgar, CPC)",CPC,6,2,"Madam Speaker, that is not very believable."
0000776,0.289666,"Mr. Bob Saroya (Markham—Unionville, CPC)",CPC,7,3,"Can the minister confirm if in fact in London, Ontario, one of the hotels in which these refugees are being housed is located next door to a gentlemen's club, which features exotic dancers?"
0000463,0.291416,"Mr. David Anderson (Cypress Hills—Grasslands, CPC)",CPC,8,0,This is the kind of ongoing failure of leadership that we have seen from the Prime Minister.
0000810,0.292658,"Hon. Carolyn Bennett (Minister of Indigenous and Northern Affairs, Lib.)",LIB,7,8,"With political will, leadership, and partnership, nation-to-nation, we are going to get this done."
0000621,0.294025,"Right Hon. Justin Trudeau (Prime Minister, Lib.)",LIB,7,4," Mr. Speaker, the uncertainty has been created by 10 years of a government that refused to understand that we can only build a strong economy when we are protecting the environment, when we are listening to Canadians, when we are building partnerships with indigenous peoples, and when we are respecting the science that surrounds all these projects."
0000300,0.295954,"L’hon. Diane Lebouthillier (ministre du Revenu national, Lib.)",LIB,7,9,Our government increased the basic amount and the additional residency amount used in the calculation of the northern residence tax deduction.
0000275,0.296784,Jane Philpott,LIB,6,8,"Mr. Speaker, the Council of Canadian Academies uses a totally independent process when naming individuals to this panel."
0000593,0.298780,"Hon. Jim Carr (Minister of Natural Resources, Lib.)",LIB,7,6,"We think a better idea is to have a transparent process, with predictable timelines and ways in which Canadians can let government know what they think is in the national interest, after which the government will decide."
0000025,0.299459,Mark Gerretsen,LIB,7,8,"Mr. Speaker, volunteers play a crucial role in Canadian society. In my riding of Kingston and the Islands, organizations like Martha's Table and St. Vincent de Paul volunteer to help build healthy and socially inclusive communities, not just by their actions but by the spirit of generosity that motivates them to create, support, and sustain non-profit and charitable organizations."
0000653,0.302282,"Hon. Alice Wong (Richmond Centre, CPC)",CPC,6,5,"Mr. Speaker, just this week, Stats Canada showed what Conservatives have known all along, small businesses are the middle class."
0000801,0.302592,"Right Hon. Justin Trudeau (Prime Minister, Lib.)",LIB,6,4,"We will remain engaged in terms of our military, but we are withdrawing our fighter jets."
0000385,0.303866,"Mr. Nathan Cullen (Skeena—Bulkley Valley, NDP)",NDP,6,5,"The recommendation from the Bloc, the Greens, the Conservatives, and the New Democrats called for a plan to bring in proportional representation."
0000104,0.304102,Pierre Nantel,NDP,7,0,"After 3,000 testimonials, 252 briefings, and 18 months of consultations, the Liberals refuse to listen to anyone, including the community, the experts, the deputy minister, and even the minister herself, according to the news."
0000267,0.304141,"Hon. Pierre Poilievre (Carleton, CPC)",CPC,8,2,"We already knew about the Prime Minister's meetings with billionaires at Davos and at the Shangri-La Hotel, where he discussed the intimate details of this infrastructure bank. "
0000036,0.305201,Mark Holland,LIB,6,8,"The committee proceedings are following detailed work that was done on the security and intelligence framework, and the most exhaustive consultations that happened on a national basis."
0000280,0.305450,"Hon. Jim Carr (Minister of Natural Resources, Lib.)",LIB,7,6,"We are taking it seriously, across the country, to do whatever we possibly can to soften the blow of these punitive and unwelcome tariffs."
0000035,0.306169,Matthew Dube,NDP,6,4,"Can the minister commit to come before the Standing Committee on Public Safety and National Security, and once again answer members' questions on this omnibus bill?"
0000516,0.307066,"Mr. Matt Jeneroux (Edmonton Riverbend, CPC)",CPC,7,0,"Mr. Speaker, as the Liberals are busy creating taxes on everything from heating bills to Netflix, unemployed Albertans are struggling to provide for their families."
0000548,0.307948,"Hon. Jane Philpott (Minister of Health, Lib.)",LIB,7,3,"Mr. Speaker, to compare the approach of this government with the approach of the previous Conservative government on the matter of federal-provincial-territorial relations on health is a misrepresentation of the facts."
0000396,0.310117,"Hon. Peter Kent (Thornhill, CPC)",CPC,8,0,"Again, why are the Liberals risking Canadian national security to play up to the Chinese communist government?"
0000941,0.311674,"Right Hon. Stephen Harper (Prime Minister, CPC)",CPC,6,1,"This group, the so-called Islamic State, represents a direct threat not just to the region."
0000563,0.312001,"Hon. Catherine McKenna (Minister of Environment and Climate Change, Lib.)",LIB,7,4,"Mr. Speaker, unlike the party opposite, we understand that the environment and the economy go together."
0000842,0.312035,"Mr. Dennis Bevington (Northwest Territories, NDP)",NDP,7,3," In the spirit of reconciliation, will the Conservatives give the full subsidy to all northern fly-in communities that are currently not receiving it?"
0000073,0.315871,Diane Lebouthillier,LIB,7,4,"Mr. Speaker, as I said, our government is fully committed to fighting tax evasion and aggressive tax avoidance, which the Conservative Party failed to do for 10 years."
0000124,0.316076,Ruth Ellen Brosseau,NDP,7,4,"For us, however, the protection of our supply management system is non-negotiable, and we will not allow it to be chipped away any further."
0000725,0.316410,"Hon. Catherine McKenna (Minister of Environment and Climate Change, Lib.)",LIB,8,9,"We need to take action on climate change, and we are going to take action, because it is the right thing to do, and it will also move us to a low carbon future, create new innovations, and new jobs."
0001008,0.317914,"Ms. Niki Ashton (Churchill, NDP)",NDP,7,3,Will the minister intervene to reinstate the funding for the Odawa centre?
0000847,0.318892,"Hon. Pierre Poilievre (Minister of Employment and Social Development and Minister for Democratic Reform, CPC)",CPC,7,2,"Mr. Speaker, while both the NDP and Liberal Party have announced they support Kathleen Wynne's plan to bring in a $1,000 payroll tax on the average worker in Canada, we have done exactly the opposite. "
0000826,0.320740,"Mr. Paul Calandra (Parliamentary Secretary to the Prime Minister and for Intergovernmental Affairs, CPC)",CPC,6,6,That is why I think like Canadians think.
0000750,0.321457,"Mr. Pierre Breton (Shefford, Lib.)",LIB,6,10,"Furthermore, the industry is a leader when it comes to environmental concerns."
0000021,0.322644,Tracey Ramsey,NDP,7,0,"Mr. Speaker, once again, zero transparency from the government on whether it has decided to launch formal negotiations with China, just like the Prime Minister's trip to Vietnam where Canadians were left to wonder if the TPP negotiations were on the agenda or not."
0000418,0.322771,"Hon. Marc Garneau (Minister of Transport, Lib.)",LIB,4,5,I know they want a bypass.
0000041,0.324337,Justin Trudeau,LIB,7,8,"The fact is we always focus on the security of Canadians, and we always will."
0000190,0.326089,Ahmed Hussen,LIB,6,8,"As a government, we responded to the largest refugee crisis in half a century by admitting 40,000 Syrian refugees. "
0000800,0.327402,"Mr. Xavier Barsalou-Duval (Pierre-Boucher—Les Patriotes—Verchères, BQ)",BQ,6,4," Mr. Speaker, on February 20, the Prime Minister promised the Board of Trade of Metropolitan Montreal that a Liberal government would immediately reinstate the tax credits for labour-sponsored funds in full."
0000973,0.328254,"Mr. Randall Garrison (Esquimalt—Juan de Fuca, NDP)",NDP,6,2,"Open-ended surveillance and maintenance of these records is concerning for Canadians, especially given the weak oversight of security agencies like the Communications Security Establishment."
0000155,0.328561,Justin Trudeau,LIB,8,3,"Mr. Speaker, the only distortions are the ones brought forward by the member opposite, who is trying to scare small business owners and torque an issue to defend the approach the Conservatives have always taken of benefiting the wealthy and ignoring the hard-working Canadians who will work every day to build this country."
0000892,0.328880,"Hon. Dominic LeBlanc (Beauséjour, Lib.)",LIB,5,6,"That makes sense, since Mr. Duffy had been living in Ottawa for 40 years."
0000908,0.330173,"Hon. Wayne Easter (Malpeque, Lib.)",LIB,6,4,"Surely, when the Prime Minister uses a makeup artist, any makeup artist who is given the kind of close access to the Prime Ministerwould have to go through an RCMP background check. "
0000940,0.330470,"Mme Manon Perreault (Montcalm, Ind.)",IND,6,4," That being said, is there now a labour policy adapted to the needs of this client group?"
0000294,0.331105,"Hon. Catherine McKenna (Minister of Environment and Climate Change, Lib.)",LIB,7,4,"Mr. Speaker, unlike the party opposite, we understand that the environment and the economy go together. "
0000794,0.332141,"Mr. Phil McColeman (Brantford—Brant, CPC)",LIB,6,6," Mr. Speaker, the Liberals promised Canadians a revenue-neutral tax cut, made possible by taxing high earners."
0000258,0.332532,Justin Trudeau,LIB,7,8,"Furthermore, our priorities on this side of the House continue to be making a difference in the lives of Canadians, particularly in terms of our seniors, where not only have we strengthened the CPP for a generation and ensured that future retirees have stable retirements, we have increased the guaranteed income supplement by 10% for our most low-income, vulnerable seniors."
0000118,0.332565,Joel Lightbound,LIB,6,6,"Mr. Speaker, the finance minister has worked from the beginning, right after the election, with the Ethics Commissioner to make sure that he is in full compliance with the rules governing us in this House and to make sure he follows all of the recommendations she puts forward. "
0000701,0.334116,"Hon. Rona Ambrose (Leader of the Opposition, CPC)",CPC,8,0,"Will the Prime Minister admit that because of his mismanagement, Canadians will be stuck paying for his out-of-control spending?"
0000422,0.337575,"Hon. Maryam Monsef (Minister of Democratic Institutions, Lib.)",LIB,6,9,"Some have already begun, inviting them to be part of this conversation, so that before we make any final recommendations on electoral reform, we have ensured that we have heard from as many Canadians as possible."
0000248,0.337923,James Bezan,CPC,7,3,"Why are the Liberals showing the defence policy review to President Trump first, before they show it to Canadians?"
0000994,0.340129,"Right Hon. Stephen Harper (Prime Minister, CPC)",CPC,5,8,Vaccines have historically proven effective in improving the health of our children and families.
0000552,0.340950,"Mr. Jacques Gourde (Lévis—Lotbinière, CPC)",CPC,8,0,"This is a glaring lack of judgment on the part of the Prime Minister, but it is not surprising because we are finding more and more examples of public funds that have been squandered."
0000787,0.341156,"Hon. Jane Philpott (Minister of Health, Lib.):  ",LIB,6,9,"Mr. Speaker, I have just met with my provincial and territorial colleagues and have reiterated to them that our government fully supports the principles of the Canada Health Act, which are meant to ensure that all Canadians have reasonable access to medically necessary care based upon need and not based upon the ability to pay."
0000018,0.341267,Glen Motz,CPC,7,0,The government knows that hundreds of ISIS terrorists are returning after committing their atrocities like nothing ever happened.
0000561,0.341314,"Mr. Mark Strahl (Chilliwack—Hope, CPC)",CPC,7,2,"Mr. Speaker, the Liberals have now confirmed that they are planning to impose a made-in-Ottawa carbon tax on all Canadians, no matter where they live and no matter if their province already has a carbon tax."
0000861,0.344108,"Hon. Thomas Mulcair (Leader of the Opposition, NDP)",NDP,4,4,Five separate drafts were concocted.
0000501,0.344124,"Hon. Navdeep Bains (Minister of Innovation, Science and Economic Development, Lib.)",LIB,5,8,"Madam Speaker, first and foremost, our thoughts go out to the workers and their families during this difficult time."
0000415,0.345120,"Mr. Nathan Cullen (Skeena—Bulkley Valley, NDP)",NDP,8,0,"First, the minister threw the committee under the bus, and now the Liberals are trying to blame us for their terrible survey. "
0000691,0.346025,"Hon. Dominic LeBlanc (Leader of the Government in the House of Commons, Lib.)",LIB,6,4,That is the ethical standard that this government has raised from the previous government that was before us.
0000786,0.349659,"Mr. Joël Godin (Portneuf—Jacques-Cartier, CPC)",CPC,6,2,His call to the husband of one of the victims was not worthy of a prime minister.
0000992,0.349737,"Right Hon. Stephen Harper (Prime Minister, CPC)",CPC,5,8,These vaccines have historically proven extremely effective in reducing and in some cases even eliminating certain types of previously debilitating ailments.
0000074,0.350414,Diane Lebouthillier,LIB,5,8,We continue to work for Canadians and for a fair tax system.
0000381,0.351884,"Hon. Jane Philpott (Minister of Health, Lib.)",LIB,6,8,"Mr. Speaker, the approach of this government to drug policy is evidence-based, compassionate, collaborative, and comprehensive."
0000980,0.351925,"Hon. Lisa Raitt (Minister of Transport, CPC)",CPC,6,7,"Mr. Speaker, I appreciate the question, because it allows me to talk about the Canada Transportation Act review, which this government has embarked on early in order to deal with issues outstanding with respect to the transportation of grain in the country. "
0000252,0.352530,Rona Ambrose,CPC,8,1,What will it take for the Prime Minister to admit that he signed a bad deal and give taxpayer dollars back?
0000281,0.353207,"Right Hon. Justin Trudeau (Prime Minister, Lib.)",LIB,6,9,We will continue to make choices that will help people across the country.
0000877,0.353929,"Ms. Roxanne James (Parliamentary Secretary to the Minister of Public Safety and Emergency Preparedness, CPC)",CPC,6,4,"Mr. Speaker, let me be very clear. "
0000228,0.354664,James Bezan,CPC,7,1,Is there at least one Liberal willing to stand up for the interests of Canadians rather than their rich Liberal insiders?
0000639,0.356520,"Hon. Chrystia Freeland (Minister of International Trade, Lib.)",LIB,6,8,"Mr. Speaker, our government and I understand how important the forestry industry is to Quebec and Canada."
0000102,0.357190,Charlie Angus,NDP,9,0,"There is something fundamentally wrong in a nation where indigenous families have to give their children away, while we have a finance minister who cannot remember that he owns a villa in the south of France."
0000503,0.357512,"Ms. Gudie Hutchings (Parliamentary Secretary for Small Business and Tourism, Lib.)",LIB,6,8,"Small business operators wanted more customers, and that is what we have given them."
0000373,0.359241,"Hon. Thomas Mulcair (Outremont, NDP)",NDP,8,2," Sorry, Mr. Speaker, but knowing a billionaire for a long time does not excuse the Prime Minister of breaking the law."
0000707,0.359397,"Ms. Pam Goldsmith-Jones (Parliamentary Secretary to the Minister of Foreign Affairs, Lib.)",LIB,7,8,"We are committed to holding perpetrators of such serious international crimes to account; and our new, strong, three-year anti-ISIL strategy seeks to address the ongoing crisis in Iraq and the destabilizing impacts on Lebanon, Jordan, and Syria."
