Label,Shuffle,Speaker,Party,Activation,Sentiment,englishHansard
0000545,0.457698,"Mrs. Karen Vecchio (Elgin—Middlesex—London, CPC)",CPC,7,2,Who is finally going to put a stop to these Liberal entitlements?
0000274,0.458657,Chrystia Freeland,LIB,6,10,"Stéphane Dion has fulfilled, over many years, many roles in the service of Canadians with honour, dignity, and intelligence."
0000057,0.459180,Brigitte Sansoucy,NDP,6,3,Why are seasonal workers still waiting for help?
0000697,0.460292,"Hon. Chrystia Freeland (Minister of International Trade, Lib.)",LIB,6,3,"Mr. Speaker, the NDP condemned the TPP without even reading it. "
0000568,0.460295,"Hon. Jody Wilson-Raybould (Minister of Justice and Attorney General of Canada, Lib.)",LIB,6,6,"No decision has been made, but we are confident that we will appoint a diverse, functionally bilingual, high-calibre jurist to the Supreme Court of Canada."
0000866,0.461412,"Hon. Bernard Valcourt (Minister of Aboriginal Affairs and Northern Development, CPC)",CPC,6,3," Mr. Speaker, I cannot help but add that if they were able to impose this carbon tax, it would be even colder. "
0000671,0.461946,"Right Hon. Justin Trudeau (Prime Minister, Lib.)",LIB,7,2,The reality is that the Conservatives are still trying to use transparency as a political weapon against their opponents rather than understanding that true transparency means having trust in Canadians and trust in our unions.
0000938,0.463176,"Ms. Charmaine Borg (Terrebonne—Blainville, NDP)",NDP,6,2,Canada Post is ignoring the diversity of municipalities.
0000699,0.464275,"Hon. Tony Clement (Parry Sound—Muskoka, CPC)",CPC,6,4,"Mr. Speaker, I understand a Canadian delegation met in recent days with the Reverend Hyeon Soo Lim, who remains in prison, forced to a life sentence of hard labour in North Korea."
0000887,0.465104,"Ms. Roxanne James (Parliamentary Secretary to the Minister of Public Safety and Emergency Preparedness, CPC)",CPC,6,8,"Mr. Speaker, I did speak a moment ago of Circles of Support, but I also want to point out that the Commissioner of the Correctional Service of Canada actually said that 95% of inmates who were released had completed their recognized programs in relation to the correctional program."
0000342,0.465516,"Ms. Jenny Kwan (Vancouver East, NDP)",NDP,7,2,"Clearly, the Conservatives had no plan, and while the Liberals sound welcoming, they have implemented absolutely zero measures to address this situation. "
0000929,0.466352,"M. François Pilon (Laval—Les Îles, NPD)",NDP,7,0,"Residents are outraged by the lack of public consultation, and the mayor of Laval deplores the one-way communications from Canada Post. "
0000720,0.466641,"Hon. Navdeep Bains (Minister of Innovation, Science and Economic Development, Lib.)",LIB,6,10,"It is a sector that employs 180,000 people, not only in Montreal or Quebec but across Canada."
0000592,0.468273,"Hon. Mark Eyking (Sydney—Victoria, Lib.)",LIB,6,10,"Mr. Speaker, the men and women of the Canadian Coast Guard work hard to protect Canadians and the bodies of water from coast to coast to coast."
0000207,0.468738,Joel Lightbound,LIB,7,2,"I hear the members scream, but my own cousin has been affected by Lyme disease. "
0000670,0.470043,"M. Mario Beaulieu (La Pointe-de-l'Île, BQ)",BQ,6,3,Was it when the monarchy imposed the Act of Union in 1840 or Confederation in—
0000665,0.470470,"Hon. Bardish Chagger (Minister of Small Business and Tourism, Lib.)",LIB,5,7,We are engaging with small businesses and with Canadians.
0000305,0.470614,"M. Luc Berthold (Mégantic—L'Érable, PCC)",CPC,6,3,"The Leader of the Government in the House of Commons claims she wants to discuss this, but at the same time has ordered her MPs to pass these changes in committee in a backroom on Parliament Hill."
0000599,0.471800,"Hon. Mélanie Joly (Minister of Canadian Heritage, Lib.)",LIB,6,7,"Mr. Speaker, I assure my colleague that our two official languages are very important to this government. "
0000234,0.475311,Darrell Samson,LIB,6,4,  Can the Parliamentary Secretary to the Minister of National Defence tell us a little bit about what the government is doing to help our soldiers?
0000541,0.478028,"Hon. Rona Ambrose (Leader of the Opposition, CPC)",CON,7,3,"Will he do the right thing, get shovels in the ground, and get these people to work?"
0000882,0.480640,"Hon. Pierre Poilievre (Minister of Employment and Social Development and Minister for Democratic Reform, CPC)",CPC,7,10,"We signed a free trade agreement with the European Union that will deliver 80,000 net new jobs, including in Honda Canada, which announced recently in the presence of the Prime Minister that it will export vehicles directly to Europe from Canada, creating 400 net new jobs in that one plant alone."
0000637,0.481930,"Hon. Dominic LeBlanc (Leader of the Government in the House of Commons, Lib.)",LIB,6,6,Every dollar spent on that trip was worth it for Canadians.
0000384,0.482415,"L'hon. Karina Gould (ministre des Institutions démocratiques, Lib.):  ",LIB,5,8,"Over 360,000 Canadians weighed in at MyDemocracy.ca."
0000375,0.483353,"Mr. Gérard Deltell (Louis-Saint-Laurent, CPC)",CPC,7,3,"Mr. Speaker, yesterday, the Minister of Finance once again succeeded in not giving a clear answer to Canadians when I asked him whether his government intended to attack pension splitting."
0000326,0.485272,"Hon. Michelle Rempel (Calgary Nose Hill, CPC)",CPC,6,2,"Mr. Speaker, we know that the funding to help many Syrian refugees resettle runs out this month. "
0000449,0.486382,"Mr. Majid Jowhari (Richmond Hill, Lib.)",LIB,5,4,Could the Minister of Science update the House on her work with regards to this file?
0000605,0.487756,"Mr. Mark Gerretsen (Kingston and the Islands, Lib.)",LIB,7,2,"In my riding of Kingston and the Islands two prison farms were closed in Collins Bay and Joyceville, without proper consultation of the public and to widespread concern from the public."
0000907,0.487854,"Ms. Irene Mathyssen (London—Fanshawe, NDP)",NDP,7,2,Will the Conservatives reverse their destructive cuts to CFIA?
0000983,0.488073,"Mr. Andrew Saxton (Parliamentary Secretary to the Minister of Finance, CPC)",CPC,8,2,"While we are focused on creating jobs, the Liberal leader has the old Liberal high-tax, high-debt agenda that would threaten jobs and set working families back."
0000687,0.492512,"Mr. Matthew Dubé (Beloeil—Chambly, NDP)",NDP,6,3,It is time to stop talking and start taking action.
0000467,0.492707,"Hon. Carolyn Bennett (Minister of Indigenous and Northern Affairs, Lib.)",LIB,7,3,"Mr. Speaker, we have been very clear that the First Nations Financial Transparency Act did not work because it was imposed top-down and it accidentally penalized first nations businesses to predatory practices by competitors."
0000514,0.495293,"Mrs. Shannon Stubbs (Lakeland, CPC)",CPC,7,1,"The Liberals are imposing a harmful tax that will make food, diapers, formula, and everything even more expensive for everyone."
0000964,0.495387,"Hon. Pierre Poilievre (Minister of Employment and Social Development and Minister for Democratic Reform, CPC)",CPC,5,4,We have limited the percentage of foreign workers in a given workplace.
0000470,0.495420,"Mr. Len Webber (Calgary Confederation, CPC)",CPC,6,3,Can the minister confirm that China is the main source of illegal fentanyl; and what has she done to stop it?
0000358,0.495700,"Hon. Judy Foote (Minister of Public Services and Procurement, Lib.)",LIB,6,4,"Mr. Speaker, while the government's payroll system ensures that 300,000 employees get paid every two weeks, there are public service employees who are experiencing pay difficulties in some categories, and that is totally unacceptable. "
0000160,0.497030,Hunter Tootoo,IND,4,5,"Mr. Speaker, my question is for the Prime Minister. "
0000540,0.497996,"Mr. Sean Casey (Parliamentary Secretary to the Minister of Justice and Attorney General of Canada, Lib.)",LIB,6,1,We know that the process used by the previous government was badly broken.
0001019,0.498706,"Mr. Chris Warkentin (Peace River, CPC)",CPC,7,0," Mr. Speaker, today we woke up to the horrendous news that Israel has once again been the target of terrorist attacks."
0000888,0.498967,"Mme Annick Papillon (Québec, NPD)",NDP,6,3,"Mr. Speaker, that was in the budget, but Quebec City is still waiting to see whether the 2017 Tall Ships Regatta will finally get the money they were promised. "
0000747,0.502610,"Hon. Jane Philpott (Minister of Health, Lib.)",LIB,6,7,We will work together to reach new agreements as to what the health care system needs to meet the needs of Canadians.
0000567,0.503410,"Hon. Rob Nicholson (Niagara Falls, CPC)",CPC,5,4,It is also the fair thing to do.
0000197,0.503534,Ralph Goodale,LIB,7,0,"Mr. Speaker, the previous government was deeply embroiled in an argument with the Information Commissioner because it was alleged by the Information Commissioner that, while an outstanding access to information complaint was being made, the previous government had taken steps to improperly remove and destroy that information. "
0000953,0.505121,"Mr. Mathieu Ravignat (Pontiac, NDP)",NDP,6,2,"Such things can be overlooked, which is what happened in Markham after the Prime Minister's former chief of staff got involved."
0000208,0.505481,Ruth Ellen Brosseau,NDP,7,3,When will the government take its responsibilities seriously and implement a payment protection system for fruit and vegetable producers?
0000181,0.508209,Justin Trudeau,LIB,6,10,"Mr. Speaker, let me begin by thanking the member for his service to his community, to the House, and to all Canadians for many years."
0000218,0.509806,Dominic Leblanc,LIB,6,10,We will continue to protect fish habitat and work with the volunteer groups in that province and all across the country that do such outstanding work.
0000512,0.510243,"Hon. Catherine McKenna (Minister of Environment and Climate Change, Lib.)",LIB,7,8,"Let us also be clear that the way we are going to grow our economy and position ourselves for the 21st century is by making these investments, by making sure that we have a price on pollution and we are investing in the things that we want, which is a clean and sustainable future that will grow our economy and ensure that future generations have a planet that is clean and healthy to—"
0000990,0.510363,"Mr. Claude Patry (Jonquière—Alma, BQ)",BQ,6,1,"Mr. Speaker, while the current Quebec government is hurting the regions by making ill-advised decisions to supposedly improve public finances, the fiscal imbalance between Ottawa and the provinces continues to grow."
0000641,0.511814,"Hon. Ralph Goodale (Minister of Public Safety and Emergency Preparedness, Lib.)",LIB,6,7,"As we move now into future phases of how we will assist Alberta and Fort McMurray in the recovery, we will examine all possibilities for how everyone can help to the maximum extent possible."
0000749,0.512510,"Mrs. Cheryl Gallant (Renfrew—Nipissing—Pembroke, CPC)",CPC,6,1, Yesterday we learned that the Liberals have already withdrawn the CF-18 air cover for our troops on the ground.
0000174,0.513603,Kevin Sorenson,CPC,7,0,Why is the Liberal finance minister treating these farms as nothing more than cash cows and jeopardizing the future of farmers in Canada?
0000241,0.513621,Amarjeet Sohi,LIB,6,8,"There will be different layers of accountability, and due diligence will be done every step of the way when we engage with the infrastructure bank or with the private sector."
0000975,0.513677,"Mr. Nathan Cullen (Skeena—Bulkley Valley, NDP)",NDP,7,0, How can Conservative priorities be so out of whack and offline with what Canadians actually need and deserve?
0000655,0.513827,"Hon. Bill Morneau (Minister of Finance, Lib.)",LIB,6,9,"We decided to invest in the future of Canadian families, to help improve their future."
0000581,0.514496,"Mr. Gérard Deltell (Louis-Saint-Laurent, CPC)",CPC,5,6,"As the prestigious and very distinguished Minister of Foreign Affairs put it so well, it is unavoidable."
0000458,0.515644,"Mr. Fin Donnelly (Port Moody—Coquitlam, NDP)",NDP,7,3,Will the government eliminate this problem by supporting my bill to transition this industry to safe closed containment and protect marine mammals?
0000570,0.516663,"Mr. Rhéal Fortin (Rivière-du-Nord, BQ)",BQ,6,4,Is that what Liberal Canada looks like?
0000917,0.517380,"Hon. Ed Holder (Minister of State (Science and Technology), CPC)",CPC,5,4,"Mr. Speaker, the pyrrhotite problem falls under provincial jurisdiction."
0001014,0.517419,"Right Hon. Stephen Harper (Prime Minister, CPC)",CPC,5,7,"Mr. Speaker, obviously I do not know the facts of this particular case, but whenever we lose a serving military officer or a former military member, it is a terrible thing, and our condolences go out to that family."
0000019,0.517959,Kristy Duncan,LIB,6,10,"By increasing diversity, we bring different experiences, ideas, and perspectives to advance Canadian science, grow the economy, and improve the lives of Canadians."
0000785,0.518017,"Hon. Jim Carr (Minister of Natural Resources, Lib.)",LIB,6,8,"That is the way we develop public confidence, and that is exactly what we are doing."
0000617,0.519002,"Mr. Mark Strahl (Chilliwack—Hope, CPC)",CPC,6,2,Why did the minister appoint someone with such a clear bias on shrimp allocation to his advisory panel?
0000698,0.520626,"Mrs. Shannon Stubbs (Lakeland, CPC)",CPC,6,2,"They cannot even get the Liberals to extend EI benefits now when they need it most, but they really just want jobs."
0000383,0.520844,"Mr. Alexandre Boulerice (Rosemont—La Petite-Patrie, NDP):",NDP,5,4,Even the people who did the Liberals' survey want political parties to work together.
0000939,0.520955,"Hon. Pierre Poilievre (Minister of Employment and Social Development and Minister for Democratic Reform, CPC)",CPC,7,8,"We are giving the dollars back to the more than eight million real child care experts who are out there, and their names are Mom and Dad."
0000642,0.521443,"Mr. Gérard Deltell (Louis-Saint-Laurent, CPC)",CPC,7,3,"When the time came to meet the President of the United States, where was the Minister of Natural Resources?"
0000817,0.521779,"Hon. Joe Oliver (Minister of Finance, CPC)",CPC,6,4,"Mr. Speaker, abuse of taxpayers' dollars is unacceptable and will not be tolerated by our government."
0000982,0.522008,"Mme Sadia Groguhé (Saint-Lambert, NPD)",NDP,6,0,"Mr. Speaker, child pornography investigations are not the only thing suffering as a result of the Conservatives' surreptitious cuts."
0000828,0.522905,"Mr. Andrew Saxton (Parliamentary Secretary to the Minister of Finance, CPC)",CPC,6,9, Our government has delivered on its promise to Canadians to make life more affordable and continue to lower taxes.
0000667,0.524926,"Hon. Hunter Tootoo (Minister of Fisheries, Oceans and the Canadian Coast Guard, Lib.)",LIB,6,6,"I would like to thank the member for her question, and I could not agree with her more; it was an issue that was totally ignored by the previous government. "
0000662,0.525735,"Mr. Jonathan Wilkinson (Parliamentary Secretary to the Minister of Environment and Climate Change, Lib.)",LIB,6,9,"We are working actively with our provincial and territorial colleagues to develop a pan-Canadian process to reducing carbon emissions and to actually developing a robust, clean growth economy."
0000792,0.526096,"Hon. Bill Morneau (Minister of Finance, Lib.)",LIB,6,3,"Mr. Speaker, we find ourselves in a more challenging situation than we expected. "
0000818,0.528344,"Hon. John McCallum (Markham—Unionville, Lib.)",LIB,6,2, Yesterday's comments by the Attorney General on operational matters were beneath the dignity of his office.
0000690,0.531946,"Mr. Gabriel Ste-Marie (Joliette, BQ)",BQ,7,3,"It calls on the federal government to work with Quebec to implement the motion I will be moving this evening, which will put an end to the shameful use of tax havens in Barbados. "
0000743,0.533880,"Hon. Navdeep Bains (Minister of Innovation, Science and Economic Development, Lib.)",LIB,5,7,"I was there most recently making investments in the Canadian Space Agency, and Quartier de l'innovation in Montreal."
0000522,0.534044,"Mr. Pierre Paul-Hus (Charlesbourg—Haute-Saint-Charles, CPC)",CPC,6,4,"In light of these revelations, does the government still support China's bid?"
0000762,0.535608,"Ms. Brigitte Sansoucy (Saint-Hyacinthe—Bagot, NDP)",NDP,6,2,"Because the agency is understaffed, high risk parcels are leaving the country without even being examined."
0000850,0.539496,"Ms. Lysane Blanchette-Lamothe (Pierrefonds—Dollard, NDP)",NDP,6,1,"Mr. Speaker, the government suspended visa applications for people from Guinea, Liberia and Sierra Leone, countries affected by the Ebola virus, in a move that was harshly criticized from the outset. "
0000397,0.539883,"Hon. Jody Wilson-Raybould (Minister of Justice and Attorney General of Canada, Lib.)",LIB,7,7,"This is exactly what we are doing, working with the provinces and territories, working with stakeholders, and working with the steering committee, which is focused specifically on assisting us with bringing forward substantive solutions."
0000966,0.543564,"Ms. Roxanne James (Parliamentary Secretary to the Minister of Public Safety and Emergency Preparedness, CPC)",CPC,6,6,"When we talk about activities that would warrant information sharing, I am just going to list a few: espionage, sabotage, covert foreign influence activities and terrorism."
0000711,0.544728,"Right Hon. Justin Trudeau (Prime Minister, Lib.)",LIB,8,10,"The House, linguistic minorities, and all of Canada thank you for your passion and your service."
0000618,0.545426,"Ms. Sheri Benson (Saskatoon West, NDP)",NDP,7,4,"Will the government commit to introducing proactive pay equity legislation within the next six months, yes or no?"
0000959,0.545486,"Hon. Scott Brison (Kings—Hants, Lib.)",LIB,6,4,"Yet, Alberta's finance minister is set to deliver a budget on March 26."
0000678,0.545709,"Hon. John McCallum (Minister of Immigration, Refugees and Citizenship, Lib.)",LIB,7,3,This behaviour is not tolerated by this government and perpetrators will be held to account.
0000658,0.546073,"Hon. Chrystia Freeland (Minister of International Trade, Lib.)",LIB,7,4,Here is a news story: “The Conservative government has hired two former White House communications strategists as part of a 'sustained' effort to raise Canada's profile in”—
0000039,0.546520,Yvonne Jones,LIB,7,10,"We are making historic amendments to this bill today, and we are remedying all sex-based inequities that have existed going back to 1869."
0000598,0.547454,"Hon. Amarjeet Sohi (Minister of Infrastructure and Communities, Lib.)",LIB,6,6," The expenditures the member is referring to were to provide office space for the minister and the deputy minister and a space for all of our staff members, as well as to consolidate them on one floor."
0000450,0.548625,"Hon. Pierre Poilievre (Carleton, CPC)",CPC,7,1,"The Liberals are forcing the hospital to move to Tunney's Pasture, which the expert panel ranked way down at number six because of hundreds of millions of dollars in demolition costs and longer travel times for ambulances."
0000120,0.550154,Rodger Cuzner,LIB,6,7,Helping newcomers get their foreign credentials recognized faster will allow them to join the Canadian workforce faster.
0000283,0.551508,"Right Hon. Justin Trudeau (Prime Minister, Lib.)",LIB,9,10,"Mr. Speaker, we are proud to be following through on our commitment to strengthen the independence of the parliamentary budget officer; to make him or her a full officer of Parliament, accountable to the Speakers of the House and the Senate and not to the librarian of Parliament; to give him or her greater tools to access information to answer the questions parliamentarians may ask; and even, at the request of political parties, to evaluate political platforms to make sure Canadians know what they are getting when they vote for someone."
0000116,0.553361,Matt DeCourcey,LIB,6,6,    That is why Canada shared a document concerning a chapter on indigenous people with the United States and Mexico. 
0000952,0.554780,"Mr. Randall Garrison (Esquimalt—Juan de Fuca, NDP)",NDP,7,1, Why are the Conservatives refusing to allow the Privacy Commissioner to appear before the committee so all Canadians can hear his concerns?
0000257,0.554839,Justin Trudeau,LIB,7,0,"For 10 long years, the federal government withdrew its support for national housing and national housing strategies."
0000185,0.555091,Ralph Goodale,LIB,7,8,We have taken his judgment to heart and in fact implemented in this legislation the kind of framework to ensure that the law and the Constitution are properly respected.
0000676,0.556042,"Hon. Chrystia Freeland (Minister of International Trade, Lib.)",LIB,5,5,"I met with Jim Haney, who is the senior VP and GM of City National Bank, recently acquired by RBC."
0000616,0.556948,"Mr. Mark Strahl (Chilliwack—Hope, CPC)",CPC,7,1,"Madam Speaker, the advisory panel of the Minister of Fisheries, Oceans and the Canadian Coast Guard to study northern shrimp allocation is woefully unbalanced and biased."
0000389,0.556973,"Hon. Peter Kent (Thornhill, CPC)",CPC,7,2,"Mr. Speaker, it has become clear this week that Vladimir Putin is testing resolve of western democracies and the new American president. "
0000946,0.558549,"Hon. Pierre Poilievre (Minister of Employment and Social Development and Minister for Democratic Reform, CPC)",CPC,7,7,"We on this side of the House are working to reduce taxes, boost training for in-demand jobs and sign free trade agreements that create demand for our Canadian products."
0000288,0.558882,"Ms. Rachel Blaney (North Island—Powell River, NDP)",NDP,7,3,Will the government leverage our combined buying power so that together we can negotiate lower drug prices?
0000989,0.559701,"Mr. John Williamson (New Brunswick Southwest, CPC)",CPC,6,4,Could the minister share with the House what we are doing to provide benefits for working Canadians?
0000795,0.560200,"Mr. Alistair MacGregor (Cowichan—Malahat—Langford, NDP)",NDP,7,3,When will the government implement its promise to lift seniors out of poverty?
0000752,0.561522,"Hon. K. Kellie Leitch (Simcoe—Grey, CPC)",CPC,7,2,"By including this funding as part of an anti-ISIS plan, is the Liberal government saying that the Israeli-Palestinian conflict is a root cause of the rise of ISIS?"
0000659,0.563940,"Mr. Blaine Calkins (Red Deer—Lacombe, CPC)",CPC,7,2,Why is she using government officials to cover up her personal vanity?
0000524,0.565338,"Hon. John McCallum (Minister of Immigration, Refugees and Citizenship, Lib.)",LIB,6,6,"Citizenship is an extraordinary privilege, and those who seek to obtain it improperly will be gone after."
0000778,0.566473,"Hon. Diane Lebouthillier (Minister of National Revenue, Lib.)",LIB,5,10,I thank my colleague from Northwest Territories for the question.
0000841,0.568273,"Hon. K. Kellie Leitch (Minister of Labour and Minister of Status of Women, CPC)",CPC,6,9,"What this government has been focused on is making sure that we take action, whether it be on matrimonial property rights, safety plans, or other initiatives to protect women."
0000539,0.572928,"Mr. Sean Casey (Parliamentary Secretary to the Minister of Justice and Attorney General of Canada, Lib.)",LIB,6,8,It is a process that includes candidates from Atlantic Canada and respects regional representation. 
0000405,0.573998,"Hon. Ralph Goodale (Minister of Public Safety and Emergency Preparedness, Lib.)",LIB,6,8,"With respect to the issue of torture, as all members of the House know, it is contrary to the Criminal Code, it is contrary to the Canadians Charter of Rights and Freedoms, it is contrary to virtually every treaty this country has ever signed. We will be faithful to the values of Canadians."
0000779,0.576127,"Hon. Diane Lebouthillier (Minister of National Revenue, Lib.)",LIB,6,7, During the election we campaigned on increasing the deduction for northern residents. It is a priority.
0000934,0.576717,"Mr. Adam Vaughan (Trinity—Spadina, Lib.)",LIB,7,2,They also do not get something else from the current government: infrastructure money. 
0000499,0.576860,"Hon. Kent Hehr (Minister of Veterans Affairs and Associate Minister of National Defence, Lib.)",LIB,7,6,I encourage all the members who have issues regarding military service to come forward to our department.
0000244,0.577006,Blaine Calkins,CPC,7,3,Will the Prime Minister restore some integrity to this place and cancel this appointment?
0000264,0.577129,"Hon. Karina Gould (Minister of Democratic Institutions, Lib.)",LIB,6,7,I encourage all parties in this place to do what they can for openness and transparency.
0000134,0.577390,Sukh Dhaliwal,LIB,6,10," In my riding of Surrey—Newton, I am pleased that our government is supporting organizations, such as DIVERSEcity Community Resources Society, to help at-risk youth get the support they need to find and keep good jobs."
0000193,0.577464,Justin Trudeau,LIB,6,8,"Mr. Speaker, the appointments we make are based on merit and reflect the full diversity of this country."
0000619,0.578034,"Ms. Anju Dhillon (Parliamentary Secretary for Status of Women, Lib.)",LIB,6,2,"Madam Speaker, having a gender wage gap in Canada in 2016 is unacceptable."
0000885,0.579487,"Hon. Ed Fast (Minister of International Trade, CPC)",CPC,7,2,They have absolutely no credibility on trade.
0000217,0.581616,Kim Rudd,LIB,6,8,Our government is committed to a balanced approach that can do both.
0000211,0.581882,Andrew Scheer,CPC,6,7,"Mr. Speaker, parents work tirelessly to provide a safe and secure life for their children. "
